LOAN_ID,LENDERS
591825,"joinfite3429, kivanc9828, amanda5225, karin9741, rudy7539, andyandjulie5874, marianne9412, qian3664, martincamilla1668, rachael1890, kyla6872, meganandnate6111, joinFITE, marie2642, bernhard1006, gregjakki6040, gunay, jacqueline71938298, timothyneal, anneelizabeth6119, jeanne6085, caitlin6765, clifford2046, debra3954, rbruce1946, mia4897, jillian3597, jennifer3256, james3657, joyce6259, lucas7396, rucha7008, jann8382, hilary5584, darla7546, annette3467, rebecca73555321"
565048,"scott6885, angelika4639, matthew68963892, mary63184865, kelly7822, pamela55024767, rafaelmaria9625, emma6745, malimuso8284, morphball678, manuel7521, tim4327, chris1681, thomas3791, arjenbriene, tory7560, michael7419, rita4706, grethe9035, grethe9035, math4792, eileen4138, john37481062, anne9124, amirali5409, shirlee1908, shauna3694, mark6807, rob45142215, 879447, michelle77908454, marymartha1666, haj3859, nick1918, henry2853, bob22265095"
563976,"wayne1511, sue3546, patrice7643, rene3075, michael5651, steve1730, AstridVanDerVleut, schlgr, rita4201, chris50694142, brett2793, andres8070, divine5769, rachel7420, papadave6487, maree1087, maree1087, mark6807, judith1903, kirt1150, michelle77908454, harald9540, livingif, rajeev8875, samantha5728, ben4049, sandy9595, sandra64001033, jimmy2771"
498611,"brett4536, kathy2412, sven6812, katherine32646940, christopher5955, pat3838, elke1381, lee8302, nileshd, rose1651, markus4422, margaret6625, iain6538, andrew7673, tutz, brenda3404, gooddogg1, leejohn8697, Tati, roolend, christian5576, shree8053, kaushik6920, sean7873, brd8029, mary5560, rangan9071, ganesh8203, gpg5402, kate6056, patrick1539, TeamLOTUS, louis9308, sool, paranoiatx, michaelhaack, shirley5620, arjen8681, bruce4907, christian41823217, jameswes, brian44293216, massimo2052, carol4839, martha1164"
446773,"alex7213, carolyn6823, emma6407, zaida4544, joan9255, christine9827, oliver3802, barbara49848652, emmadowd, norman2619, james11062745, sharmiraj7599, jacques7602, melinda9122, julie8037, josh7490, 777, kate4058, judy8784, jessica84665012, kathleen3905, valerie2879, david61297495, david72363334, werner1996, christina9139"
506701,"steve3631, rene3075, william8107, wiesner8145, kristin6021, peter1368, shari5504, maky, charlotte3474, tina12088886"
374332,"alexis8740, kathy4214, amy64911549, maria8631, maria8631, trudi2482, darius1195, suzanne6771, ann9722, barbara5610, leifandvikki2593, frank6126, valinda4511, ann9134, tieres8084, joshua1015"
514179,"andrew29332255, elizabeth2894, saratoga5504, mike76198005, michael9854, julian1959, lance3492, jesus8580, debbie8214, john3369, ray8683, jan4515, bryan4089, rashmi6205, matthew9653, claudiamichaela, theo4159, jimandgretchen6248, annette6246, goldseek, billykwok, billykwok, john6554, bret1933, marc2432, kiml3357, trolltech4460, tom1471, adam4707, chuanpow9262, sussi3690, eric2972, garthsworld, dermalogicafitecanad2401, patrikmalmquist, carl4161, ngawchee6402, ronel6429, joey3823, beth5389, kristina7226, kitchenerwestmount6111, r3922, mariaeugenia2936, laurence4295, john8478, wolfgang3771, ray12491432, barbara72435120, allwinjose8370, donald1275, bryan8490, roland3692, marja7636, will8607, laura9820, dvmdave"
569655,"janelle7432, paul3684, rebecca93704581, anette1054, maripullen, iolaire, julie9535, rob5287, jenna3016, dick3380, ted7590, iona9171, soheil2873, john37481062, ali9555, janice7386, katie7936, prescott9694, david70412018, jan2853, tim4327, lesley3694, kevin6705"
429254,"gail5182, alexandra5362, mary1469, vianney6061, vianney6061, tiana2318, joe3418, jeske5877, hanne9915, reallyreallybig, gooddogg1, scott8951, joseph3185"
566028,"rebecka1875, sheila9155, alex9062, ian8364, paul7581, ankuranddivya7190, terrystl, jana8419, tina9256, mike6880"
377958,"michael8899, ronandcharlene9547, tom6195, hannah5518, juan2853, sergio6284, AmnestyInternationalMHS, linda52533652, trolltech4460, randy1735, DianeR, silverbrook1367, kathryn7140, linda2903, arenewal2359"
350359,"strongriley, scott36431587, timothy5448, mark10007092, mark10007092, gavin9694, noreen5900, nigel5030, brianbond, jason4900, laurenandkelly7176, susan9138, ehsanandameneh, gavandcath5365, lariat, thomas3791, curtis3826, howard7012, carlos5267, Bobbu, benjamin7510, muke1206, sweetmustache, globaleducation, eddy6118, harrison8658, thomaschristina3699, dale8639, deborah2568, trolltech4460, dariolopez, milan1569, rod7860, jangoyvaerts, gary6000, jack7651, kylesullivan, sander6472, greg5882, peter5974, peter5974, linda31614027, bruce2043, michael31419940, winifred3546, pbussey, houtan, ali9555, shawn3118, jeffdonthemic, hans3674, scott38062522, thomas8848, mark7049, unicorn, clive5910, janwillem8341, kelli9931, tom5434, renee6561, morphball678"
450821,"jana4261, colin9141, ian7566, john3420, esper6067, kevin9884, berliner, thomas8298, orz, jennifer2453, monicaanddavid3242, christine82, jonathan5692, pryor2007, aaron9116, theresa5292, shawn9175, damien5288, spencer9272, nancy6152, jan8763, swissnodak, todd6525, rory4337, gareth3204, wrnjg7560, john53044997, barbara3411, zbicyclist, mike1434, julian6479, julian6479, jonasmalin, martin1655, odgo, eric1316, craig8612, erin2298, debbie8907, trolltech4460, mark5902, mark5902, olaf5782, olaf5782, Inventum, dave2993, bruce3781, markandvinny4056, nathan2418, bill8831, karen3043, elliott9385, goathork, anuzis, jeffery5686, thomas8591, bruno1313, miroslaw7058, jenmeister"
514454,"avi7002, sabrina3877, ellie1920, lindsey2077, jan43916062, argentini2666, mary9011, adam5827, nancy6440, alyssa7014, codlbl8843, codlbl8843, melanie1879, ryan2449, phyllis2455, andy9217, jenny5788, susan1867, sheila8955, martin80943389, dave4057, linda7159, elizabeth1274, laurie8872, rochelle9426, carol3594, valentina1158, ken4355, mark38201318, gisele3051, gisele3051, ben58949376, lars2263, jennifer45742035, marie1147, russ2582, kerry16079210, alejandro8695, michael7105, debbie4219, peter6281, sussexleoclub1526, robert5348, papacaleb7126, tiffany9840, greg7812, wakibi, bill3217, hans4837, carrie2798, terri9108, umbertoperna, mike7381, martin5212, mark4592, davidandlinda7418, tom6383, andy2301, toniandsteve6198, christine5622, arnovan8130, jeff3350, robert1414, saul9521, sue9155, elsa5438, paul33093331, connie5398, howard4754, rae9480, barb4644, michelle9518, rick9734, gordon9281, lisa1072, cheryl7558, paula4757, ann6094, anthony4142, anthony4142, lora9803, stephaniedb"
494568,"mirko5706, joao1114, thomas67966483, rona8260, fundao3249, fundao3249, stephen6143, colin6778, oliver9324, chuckandnancy2911, joreamy4346, anne9438, aaron9619, david8684, jonpet, noeleen9167, trolltech4460, jacob5249, grant3141, theodore8315, gary7187, kaj6337, kristin2836, david3687, eden9590, kelly5499, rotaryclubofkorea1918, stefanelsuizo, mark8479, jared1702, axel4317, marcforand, katelyn7336, runelov, adrianamasser, kathleen8815, george2816, deb2685, everett6760, thegrizzells6942, sebastien6452, winosaurus, helge6734, jane2788, theepsgroup9237, kerry3464, valerie9938, chris8676"
380758,"katie5739, brent8739, erik8503, andrew3092, stephen2927, pam8105, tyler49505252, amadou3499, harold5997, harold5997, ramon1678, katrina9781, yasu8049, howard4162, amnesty144254, janandjohn, nfolkert, julian8731, venlahenri, kevin8797, maile2650, InternetSweden, andrew20774151, adriangraham, manoel4383, sharon9941, gmct, gmct, hanseah, oliver3802, dennis1523, james4495, jmpprado, christy1998, sadie8375, elizabeth60124260, evan6556, hilberto, xveganx, jane7027, mouchicchoc, act101010, dukedelaet, chuanpow9262, familyof5268, karen5766, dps, yongsai8212, samRI, nathan8055, harlanstephanie5699, doris8190, kate5193, danamarketingllc, michael14958840, robert79479445, patrikmalmquist, ali9555, serge7667, peterandruthann2757, jerome8172, matt0, rene9190, cubsandfins, ross1200, mikael7391, noonrotaryclubofarli8687, natalie3983, amornwan4232, debby9002, greg1071, tim4327, sydandluke6906, adam4635, ngawchee6402, nickgabr, mubi6181, christopher3914, christopher3914, david6195, aneesh6442, cnpuz3649, flags, marialuisa3485, jmastey, sue5016, richard2839, graham8292, brian9505, darrell1739, bryce2678, peter4508, margaret5750, lee6515, kiml3357, offxjc5255, oakview1477, rob5122, louise3724, brigid2935, john7077, derek2528, mary2445, emmanuel9892, miyadean, jeffreytoddgross, ralph8897, rebecca8795, reuben9530, judy3495, howard7012, paulmarlisa, samuel8067, dave3351, anita7459, rebecca3499, april5858, rich7083, barrie7327, jim4563, john6488, robert6018, orionjrhigh7319, jenifer3162, ronald8745, murali4089, maria36792083, frank4552, ganesh8203, oakviewroberts, divingdoc36"
383858,"katie5739, brent8739, todd4917, jack8588, betty9229, richard6476, harold5997, chipinforchange, howard4162, david8807, dona6637, preetiandvinay2060, matt0, vernon4221, michelle6155, leiftaa, SHAPEInternational, mark6398, joanne1700, emily6244, paranoiatx, steve3487, sydandluke6906, nathan7007, jean4710, giovannicataldi4083, giovannicataldi4083, giovannicataldi4083, kamil1573, kamil1573, meesh3787, art7961, gayle8935, doug7210, juanpedro1872, lsanza, melissa9507, mads3617, rebecca3499, lars51469, david7683, laurie8338, irvingtonhighschool, irvingtonhighschool, paul43665199, bob7742, QueNoFollamos, holger1861, pl7463, michael9533, howard7012, adrienne5059, manfrin, william4369, kent7441, jmastey, elizabeth4482, everett6427, arun, julian8731, eliasdebbas, highgrovechurch, peter1777, bob4739, simon1158, jonathan3195, trace3320, gmct, gmct, christinegrace, jim4563, benton, martin1969, divingdoc36, lloyd9170, lloyd9170, korbi6126, shannon9663, raffa7727, fiona5734, delsa7805, delsa7805, michaelmaccormack7, bill1069, neoaid, tom7497"
918659,"fairspirit, bob4739, icurhere2, lidia5529, julian8731"
919100,"charles1276, themissionbeltco, stefan3072, angela17063164, greg8479, paul6937, ruchi4401, kathleen20914566, charles2813, edward2451, susan9519, JHerrick79, cherie3380, susan1748, jeff9168, danny2861, thomas8298, ann6936, turan3736, phil40048703, szabolcs, ann8808, albin, susan28551412, joseph5661, jon39695871, daleforrest, lissa4864, bill7567, claire3095, vasudev2467, dillip9674, andreas8723, katherine6151, shawn1135, thierry8170, ashley4161, hannah1379, kristy5265, katie1181, smirne, mitch3860, bryce4379, winterwolves, edward1525, julia3961, lorena2424, dave2533, grerritandjeanette6094, mike7177, kristanico1869, lisa28722122, dan1451, janetandbill7477, mihail2073, marshall2578, desiree3747, frank6177, jennifer9507, viki4243, bruce7526, sharon3004, angelina38572093, margaret7693, maynar4752, eileen8965, mike9624, steve3554, madrid3890, david2873, matthew1931, bruce1644, jim7632, andreas9409, elisabeth4390, michael93665318, victoria8792, ariane8159, erik2511, catherine5629, johnw9830, brian23771712, alysia3922, erin7328, linda5146, mike2649, danielle5958, gert7018, raedia5259, samar2856, izzy2536, willem8992, amit2303, harish4472, daniel94924553, marcia3249, jennifer2677, donna2330, ronald8787, wesley7750, amos2227, gordon1889, eileen7579, wynne1467, olekristian4897, sharon85218964, mary5127, mary68958317, rich6039, drmarkus7463, diane3386, pedr6502, rosie5239, atle9749, mark91561035, kathleen9427, cscp8394, sandy6033, karen3193, mg6010, aimeeluv, pattersonenvironmental, salt8082, scott54321452, ecigarettereviews, sharon7856"
917626,"jaredfielding, gooddogg1, bob4739, judith5696, vince5234, pattya1829"
910509,"jaredfielding, gooddogg1, shikha1085, robert93921540, eliasdebbas, gregory7186, michael7107, burke6452, dudley8758"
921110,"jaredfielding, bernal4335, amin3839, debbie7795, arthur2640"
917465,"bob4739, william4267, max5129, barbara5610, dps"
914696,"bob4739, joseph4180, judith5696, dana9865, matthew8524, judith5696, stpaulsunitedchurcho6657, dana9865, rjhoward1986"
917668,"fairspirit, maria44596761, lkbm, rene3075, peter4508, ldskiva, onemilliondollarteam, barrie7327, mark1580, angus5604, susan1804, sharon64276586, sqmedia, nick9073, christian3265, frank7618, ltr, gavinjordan, amirali5409, mandy6112, zara1386, jmastey, lenderj, giovannicataldi4083, dean6950, ken2617, jozef7312, sander3009, spencer5657, delsa7805, hakayati, danwanous, maplegrove5841, rebecca3499, michelle77908454, barb5416, user9706, carole4874, jensjrgen8326, cecilia4894, albert9733, maria44596761, maria44596761, maria44596761, maria44596761, maria44596761, torben2667, cfhsbw5234, paul4243, immanuel2402, mike76198005, maarten6000, tim25216346, matt7510, christoph2410, kevinw7993, dawei9087, barbara63616421, michael7319, ambika, nasser4682, nidthiac, rosemary5550, debra2202, david6495, erika7473, aidan9861, barbara4697, corentin8132, elias7267, benzheng, jim1475, shayna8590, tuija1664, paul4339, laura3626, gracie3460, mya7809, barb6640, anuzis, miley7483, tito2796, celina5100, sophiaChen, diarmaid, john37481062, bob6557, kevincoates, les6208, gary7362, cht, joinfite3429, thetelf, adamscottprice, dan9052, morganstanleypif, martin19327955, derekconlon, mikeclay, raffi4065, DirkLebe, andrew4650, misch, paul2112, tonia1975"
904316,"am8748, gooddogg1, nms, cassie8819, elias4241, elias4241, elias4241, elias4241, fumiy, nms, jack80"
917994,"bob4739, judith5696, judith5696, dana9865, matthew8524, barbara5610, judith5696, judith5696, karen3027, dana9865"
829417,"michelle77908454, steven1244, janeaustensocietyofa7479, tim4327, wilfried2665, ing5038, richard3302, garraud3097, nancy3283, nms, nancy3283, drouq, randy1341, sarah83911695, matthew8640, petra3606, ian3822, meagan3516, darcy2377, claire8087, devony8042, michael7010, ayjbusinessclass2900, susan4083, greenleaf, theresa9570, sharon047, thomas9883, nancy72772361, tim8686, erica2168, Lutherkent, mmyzhao, joanna6351, tim5294, vesa1879, ray12491432, menno3710, mouchicchoc, trolltech4460, peter9725, nms, kevin1460, roger79776285, janette5109, pam9026, ellen4469, cece1057, m4288, curt2871, cecilia8952, paul1298, carin4980, christopher5175, craig97299604, cmarcondesjr"
839691,"muc4u, david4520, Derrenger, wxtornado, joseph7775, sander3009, carolepauline9161, pshuang94122, LoisandOliviaFund, nms, albert9733, amdanil, daniel1104, susannah8207, tim2301, andrew13722181"
830247,"maziqbal, theresa8537, richard71092580, alexander8557, josh6623, nigel4330, johnburroughsschoo2788, nms, michelle6808, elizabeth5434, ramzi1441, hari1081, danzhu, nathalie8629, morgan2509, karamfoundation7379, futureteaming, eric5474, gooddogg1, alnore2950, david57361174, lushfan, saleh6971, wray1701, pennyandjulian, jenny3234, suresh6514, eliasdebbas, amirali5409, svi1369, milepointmutualfund2506, hagai8160, williamandmarjorie8211, brian2178, melissa5733, john37481062, maryqin, andree4468, george9290, deepak6315, lanzypants, nicole7183, kweilin2382, rune8679, tom3375, denise8691, susan1070, kerri3129, khaled6092, kan, seth4264, norman8889"
841655,"christopher17326349, deborah2112, maggie6088, kim3795, edie9836, bill9668, fernando7029, robert40361460, nicole4196, munjeet7627, jeff65625932"
839112,"stephen12718810, christylittle6155, mark8950, gemma1175, john37481062, lone9277, anup2388, aaron9341, kelly3055, jonathan7775, arjanenfroukje5510, joew, esther7143, michael2609, nicholas3737, mike6272, huttonandcollins2262, sheila3222, leanne4484, anthony5518, nancy9263, krauspartner, stephanie7989, tami2831, barbara1863, tim4327, susan22706312, barbara1475, susan7241, drahcir, charlotte6601, ann8808, amouric, tom5765, justine2512, missbelinda77, am8748, teresa6201, marianne4957, diane1375, paul6872, vaughan2078, rosalie6417, alison1381, larsjohan, literarysalon6228, alex1899, Oliver10303, rita6805, shirley1905, keith4234, lars7002, james4955, thelma4837, edward4708, wendy6414, roberto3298, tom6718, iryna6226, robert3124, lori96077575, tracy7251, kevin9393, bonnie3550, doug5442, eivind7410, allison3994, matthew2546, dd6741, ginny4304, kelsey2414, janet8995, derek3115, andrew54238614, craig78258566"
836414,"jess6423, rhonda6188, john37481062, timothy7209, richard97681098, patrickkeith2337, jamielikesyou, barrett5481, ken9001, kay1443, ginnie7191, gibb2671, k2225, nick8194, miugroup6916, carole5808, rob9037, menno3710, gibb2671, rockinrobby5419, evancarmichael, zim7148, maria3264, jeremycole, franz5727, lauri1344, debra2409, dimitry5642, trolltech4460, thierry8170, dan3878, joinFITE, anton9118, rjhoward1986, robin7318, birthdayball6423, kevin85169812, sarah23527846, themissionbeltco, elizabeth37032238, gwen8743, cary5117, neil8193, jmastey, david84744840, kelly7790, jpeto, joseph2491"
831581,"petr8989, ronald8745, maryse5220, dee9933, mark8950, peter4508, margaret4958, shauneen4684, maplegrove5841, dwight3508, rosalind, michelle3413, judith4002, cfhsbw5234, rik8272, george5302, andrzej5545, roger11905654, sander9462, torsten4937, kevin91, ken2571, ck0913, graham3235, rachel47462926, viorica5006, peni1873, janandsiga, allison9471, zane9551, noel5187, mayank, eric8011, kathy74957489, frances4182, robert7238, nicholas4111, barry2586, dina4305, barrie7327, john37481062, william8740, mike001, nora1024, nanette3855, art7961, hans8594, mbc1842, nicholas5288, wakibi, raabolle, jennifer77138001, emofund, rachel38904939, martin8406, oakviewroberts, walterhpdx, bob8829, matthew2497, vineet7754, lawrence6466, Colin9783, nicole8970, louis8129, giovannicataldi4083, verne2519, tom7497, debbie36166421, rachel1473"
1868182,"rachel5238, niki1212, andrew9662, sharon5739, themissionbeltco, shawna3245, rafael5796"
1884393,"sierrafoundation, afalk, cecil4832, jbruce7267, felix2233, eric6335, carolyn9085, jim1259, kstefan7227, jonathanandmegan, patricia7654, takashi5838, cindy7513, joseph9450, nathalie5154, travellingmatt"
1886029,"sierrafoundation, scott7003, nikodem, markus224, pschoefer, gabriela1946, david97757124, bet3782, prasanna, andrew2780"
1879812,"gregory50304596, john40218064, bryan9529, victor29541840, jennifer91239315, david71844526, mark1995, daniel4042, robertj9094"
1884654,"dirk4795, gerimedica, tamine4538, fabrice2051, raul1053, matthias9737, lauren4492, nomap, lorraine5542, connor46914316, briana1461, rich87756663, rolfarne6901, jeanpierre6903, johnny5646, mike8560, BruceXIXI"
1871295,"tjcioffe, karen6818, alan6332, sueandbob4088, constance8414, rosemary2301, chris55064116, laura83821236, paddy2050, madhu9730, donald4249, annie5927, wendy4609, kelley9568, donna1077, hindy1590, lin4606, pat4041, barbar2475, brian6033, jean5745, themissionbeltco, ron9909, jamey3149, mike94382977, shawna3245"
1888220,"vikash3311, anurag1665, lisa4217, colin36493950, ramsuresh1624, george96462312, petra9641, sandra7464, nuno2148, bonnimudd, essam, louise7223"
1881219,"nigel4691, ryana9900, meg1198, schlgr, guillermo2839, julia27648815, sheila8767, cheri2464, peter1701, terri75612562, william8576, claudia2125, margarete4234, kelly9568, wendie6656, pancake, jane8025, galen8948, geetha9630, roger5723, jim5658, lori4661, ariane8159, edmund44506606, doug7265, diane5996, vineet7754, irmgard2769, taja5349, ricaurte1012, art2129, morten5470, suzanne5688, joyce4274, kristin1335, mark14124646"
1885553,"naked8811, stevecook3dw, markgrimes, johnny5646, richard3313, wendy2060, eve2342, raymond1808, jesus8580, mikofio, gabrielle1448, james4118, janet5307, lumrtb2846, michael9666, tristanloper, ruthann7932, jeremyau, wai9473, maliwan9200, amanda5852, masako4004, ravi3866, dilan1697, laura4759, jane6230, frederick9603, heather8754, celine3195, Gatohnegro, nancy92927446, david57181047, florence3401, steven7286"
1881418,"edwardotis, stephanie19601438, derek7603, eric89347678, jasonsamfield, flateric, john2069, joseph2159, bill7048, gigi9362, barbara57074931, michael6486, steve9912, nick80623067, marcia5427"
1491036,"darian4252, vrullan, WCA, Birdman, gigi1645"
1506361,"david89779370, john8860, les5197, aaron72711230, robert30127055, doris4903, rachel9828, sonny8422, themissionbeltco, claudio1490, jncraton, nicole65096786, jesse8698, jaredfielding, texasmark, bahram3005"
1507148,"anonymous2012, nms, judith7193, anne13233714, evankatie7694, susan39707195, martial3595, richard9250, nancy5268"
1507223,"randall4421, daniel5970, nms, rene3075, apochiraju, jeremycole, goldseek, gary2695, mike1589, ries5734, matthew39324782, lesquennevaisschoo9852, philipp9965, cathleen2611, paul2842, paul96408273, jason9700, erik9484, jeffrey4676, lincoln7482, chris5368"
1506397,"roger5030, wakibi, judy8462, rik8272"
1493496,"arthurj7683, michael32781964, michael32781964, michael32781964, edda5270, estelle4041, anita8319, theresa2041, donna9770, vernard9245, james24695014, robert35071157, allyson80544499, gordon7144, esther9248, vaalea, sanjeevnath, sarah6524, mahmoodp, jan5983, zoe5123, evan1982, elena2526, fundsforthefuture, michael11013566, kivapgh, andy42, vito8085, emma18757274, christina7024, ss23, loretta7855, roxanne8098"
1492909,"kathy9985, alan3028, daniel98469874, denise6312, szucheng2565, michelleandkristian9819, paul2135, anjayves, nickjhowe, themissionbeltco, pilho8822, sarah2910, kathy9985, chikyujin"
1495245,"kate1968, andrea94621159, oliver1232, johan9263, karen26117297, knud2753, regina6298, kirk4437, jimmy2343, william8511, romanboise, joel8063, justbeian, gordydotcom, gabby7541, ian2116, robert3111, urs3576, sanjiv6738, suzy5431, Verdad, barb6884, dan38351730, susan18857800, marguerite8205, charlotte7749, laine7398, larry5803, aldora4914, michelle8983, myra8379, kristine8311, jessica21283371, robert4023, manisha3881, carolyn8727, barbara2134, arthur7556, jim1064, inge3727, wendy4991, chaz6113, gina9864, jane7929, patrick23826230, joshstraw84, tamie4284, daniel99786543, rick6778, jane3529, cecilia6601, erica6509, brooke1792, MOMSClubPhxNE, barry8849, robyn4817, elke1381, mbc1842"
1508764,"jenny3234, ellen2421, edward5102, helen8561, antonia7134, mark2212, anjayves, tuniaerik, tom59673895, dean9547, patrick8466, julia7809, nodnerb93, alidad6605, glenn2136, tariq5201, noel7456, ken68865713, paul2135, ben5545, craig4072, follenchurchsociety1010, mike76198005, trolltech4460, themissionbeltco, david12338444, adriendt, berletim5544, morten9692, xavier2132, kristal4355, teresa1009, a9434, chad82637522, brendan1973, elisabeth7633, beverly32961507, megan6892, graeme5769, bashardari, rick32839045, michael68877343, carl6659, thomas74953040, philipthelma1756, janet2690, robin10166906, shane2810, hannah8232, matthew5167, nitin5026, david7904, paul3334, bubs"
1492227,"hina4962, ramesh1227, ben7974, adel8142, adam8733, etsuko4818, katrina5162, lucy9385, bliss7125, sue4183, ron5108, harrish8966, khaled1330, laura26052215, carlo9349, george3498, ahmed18169901, suvir, chris5230, presentationmicrofinance, trolltech4460, daan3838, mishcondereya6129, ian8251, netlash, evergift, samah5142, jeff84007133, wendell1505, constance2150, n074dr460n, pallav6208, ivo5564, elisabeth8470, naseem5973, kathy5769, zivana1715, jill1108, onyeje6671, maarten7724, ahmed2594"
1500539,"sqtruong3619, steve87908302, franciscojose2669, marvin6460, exvestment, irene1993, amin3839, mark91086223, joinFITE, barry7614, trolltech4460, taneli7412, dan3955, david40892223, steven56141360, craig97299604, daniel1513, edward3203, scott23416254, richard7645, jeff4013, jennifer60688272, george3748, jim37932403, trever4408, xavier4124, steven2879, elizabeth97352632, ngawchee6402, salome4693, rui8553, cherian4431, korin1692, evergift, thomasthecoder, kathy7443, sadeq2189, michael37829042, megan2427, dorothy7076"
1499131,"maureen6161, roger5486, nicolai7738, michelle31326820, jeffrey5016, fairspirit, morten9692, johnburroughsschoo2788, marc23987853, scott23416254, P2PSOSLoanFund, barbara5610, anon23456, aya1111, michelleandkristian9819, jouko1940, phong3551, jouko1940, anjayves, wilfried2665, vanhara, azchan, don9212"
831702,"richard71092580, sukumarprakash, hinsdalecentral1098, dawnjason8007, carmelandjon4236, raj5829, oshada9527, john37481062, john97245037, amirali5409, roger79776285, achieve8042, gooddogg1, eileen20602069, jugal9865, anayansi3103, susan7154, jeff4089, mbc1842, thomasthecoder, moe4094, pradeep4473, monica2451, lynn7196"
839335,"denise42706539, june9313, amy9661, forrest1056, cedric9115, jeanjo74, john37481062, parthiban8941, RichWilliams, scw, alfonso6773, mandersn, mary6273, isameer, lkbm, michael5355, torsten4937, anne8227, christoph8452, shankar, rene3075, pauldezwart, matt20864835, barbara21631796, patricia9995, maira8623, josine1418, ralf2265, sarah14678591, fam6511, steve1618, dan2406, jen4793, eric3449, damiano1651, duy2915, anonymous20200701, michaeldelgreco, jenna8343, scott1736, jmastey, justin8222, kirsten26123431, maria7169, asmusbirch9208, allen4256, rolf9026, esther11556269, bentgjendem, jurasick, gottfried2137, simwyck, joost7022, henry3125, emily4001, david15503009, corey3360, tuomas2134, robert7764, patricia95992125, terri3004, aakash2170, jonathanlewis, mirko3562, irene1367, tim3971, stephanie9193, terry7187, mark38497307, sander3009, alessandrorossi, lauren8617, wendy9214, jan6372, onnie1182, antonio3415, mary30547287, rachel9374, wency9732, axel8696, psl, jane4072, alison4045, timothy4128, anita7459, brianandterrie5781, johnw9830, ericwillblowyourmind, jason2290, aliceruth, kathleen2580, ayeshakeller, bjrn4349, bonnie8175, paul96759560, robert1955, andrew75075744, stephen4446, woodfamily, walawalkar, daniel11829912, guillermo4314, rebecca36033356, torsten3774"
