LOAN_ID,LENDERS
233239,"sergio2573, janet7717, ridley9296, maureen2394, mark3782, elizabeth57456133, abgrevon7124, janis5500, courtandann6026, david2947, ingrid5682, andrea5436, mark2704, david7714, dora6974, donandruth4501, hillside6128, daniel6944, svetlana8063, asa8330, asa8330, gra4452, csilla4751, jennifer0517, jim6384, arlette5026, robyn6924, lisa5989, theresa7047, childsupportnetwor3169, megan5776, phyredancer, samantha6090, peter4729, intersecthomes, leigh9976, courtney2964, john3380, lauren5409, geeosh, annemarieandrolf5178, henrik2189, kerry4093, erica3736, vincent3956, natalie8525, diane1040, RobertGalavan, darthbear, jillian1643, martintull, elainelfloyd, jason8414, saraandalyn9388, saraandalyn9388, heather2318, beaandgene6685, tim9844, gregory7756, guigue, kay1361, facundo3515, mirek5535, catherine43009527, desmond3696, erik1602, gooddogg1, ursulaandkenneth5659, michael2112, donnelly9271, donnelly9271, mats1256, erika1781"
272518,"kevin9872, janpaule5036, BryanMain, BryanMain, claudio8129, peter6330, suzi1338, stefan3049, ben2211, pedro77, bharat9547, alex96771246, tony1926, cpaleadtroy, paul2343, sigmaphiomicron1199, sigmaphiomicron1199, charity3380, linda2906, jason60295355, shimazaki, paivi5900, kayran4281, yoclan5673, julie1967, ericalice6630, bill9744, ubuntu8366, ubuntu8366, martynandgill6446, menno3710, ann4041"
335835,"kevin9872, vernon4221, brynyoungblut, joni5291, lisa4017, jeff27735883, elizabeth8999, michael78458536, guido8966, steve1919, henry8567, nora1591, pat2976, mary3631, simplymonica, jonathan6863, thebrayfamily9060, lauren19797575, jessica5632, LibaT, nigel4330, joe7437, laura1188, annmarie5717, amy4914, michele4127, joanna4518, barry2087, sandhya2698, jordan9714"
62634,"gary5642, roberta9518, rui6329, jenelle5215, brian7184, pomerleaus, marktaylor, gregory2218, boris, brian9173, allison2818, julie2295, nocounterspace"
145399,"kevin9872, baraka4619, dave4725, songbird, connie2545, diane1247, diane1247, tina2094, nigel4330, markgrimes, catherine6918, evancarmichael, valerie8331, linnea4067, Hamza, steve2410"
124734,"kevin9872, christian9262, brittania8957, kara7869, dexter9570, jamesanddonna7957, jim7533, karen5277, karen5277, karen5277, ann8953, jun4634, jun4634, susanandpeter1110, susanandpeter1110, john6554, helena6024, roger5995, justin1929, megastarmedia"
242986,"kevin9872, denise8691, stefan6052, mike1401, susan9048, leenar, sheldon3029, christchurch2861, george23907283, kathy4358, laura7269, jasonhalim, matthew30378847, adam2558, tomerik9584, martsrinandpete9620, lori9737, diane3202, art7961, chrissara7982, earlpollack, david6172, OptimalPayments, OptimalPayments, OptimalPayments, OptimalPayments, anthony2444, gareth4534, kilbourne5131, salim7818, jan52553422, michael7008, jan1585, andrew2895, andrew2895, lisa4174, bettyann3399, victoria5234, howard7012, evancarmichael, pablo9232, brian8031, william4369, chaochien7635, norm1758, olivierfreuler, aaron83574977, cmohan, cmohan, marshall2351, andrew67005561, sarah9586, daniel2910, ken3723, alec9180, andrew7872, dasha4477, chandra8439, laurence5353, rudy1399, carl9950, matt8316, ines6182, terry3106, ksevik, steve8067, nfolkert, kivaben, torstefan5135, jim4563, wayne5643, kateandsteve6563, bouwejan5617, howard4162, chandra6501, rkj, crystal4048, monica9088, george9973, siccovanhoegee, dqqpkh5136, stefan3006, kathleen2428, joandleti8241, gooddogg1, john5936, roxana1612, lucinda2561, rod6651, coral8615"
130998,"kevin9872, nancy4154, inger9811, paulette1947, arthur8450, babs3703, outbackislanders, matthew2546, janandcraig8712, mary8753, quinton3417, allen3697, didier5988, daniel7862, clara6443, alan1286"
159745,"bryn6611, steveroh, mark8147, mark8147, patty4235, connieandbrint6144, dick9928, kang3544, wesley5529, devesh5685, julia7844, wongacom3393, leonardo6792, mark4535, marla7928, john6126, chosei, barbara1535, dave6612, priscilla7461, priscilla7461, priscilla7461, antoinette4416, huu1545, jack3433, augustbetsy9922, mark95011751, dave2470, thomas9360, markandalix9284, judith4002, andre3639, liz7668, karen59924625, kathleen6128, hany, amandaandgreg, colin5541, chibinium, supportresort, anukriti8749, helaine4774, augusto5880, robert96801959, marlene6547, brianhastings, mike8301, darren2749, stefanwiegard, linda2470, james8631, eric6358, meridth9629, sharon78734686, elisa2917, travis2338, human8531, monique1102, lee2218, annette6262, hikoyuki8704, hikoyuki8704, annie4594"
253919,"michelle4206, daniel6644, rosalyn3604, paula9747, inigo3012, elizabeth94647288, sue7728, vasu6972, hildemari8309, eirik3759, lamorindakivaclub, susan9749, firstparishchurch2451, washington2149, kellerfrau, alasdair2280, peter3613, nate5330, sebastian8227, sinclair5416, kay8732, sarah4257, brewebb, connor9599, elizabeth58166661, maria28308952, laurel2277, line214830, jack1373, lisa2757, kevin6073, Anchor02271967, rene8330, nancy1762, carol2513, pam2498, neil6248, weitblickev4859, tess7203, bruce9526, maddy3823, monika5956, james5454, columnex, dana4314, kerberos, emily2171, christopher1030, phyllis6428, beatrice4551, lynn8171, swala5421, marlene3489, james2828, yolanda3149, deusvitae, guy9829, kristine3129, josephine9530, sophia5100, marta9934, ken4364, kanchan, ariel5001, dmeyer, patricia5991, jenda9314, cindy6426, jeffrey4927, david2051, max6448, sherron7977, mary5936, tania1904, barbara3586, julie5260, socrates, kerry4571, aloftgroup8755, satheesh5974, erin3822, olav9939, charlieandjulie3706, amy7899, joop2502, rudy5757, DianeR, doug3440, peggy9053, jeremy7904, christine4344, megan1592, richard69809641, kiva5397, patrick7993, danilo1664, stanhope8974, matthew2546, deepakgeetakevinronak, marioandheather2964, leemans2607, edward6757, odaken, linda9453, bruce3606, anna9932, desirae5470, katariina9713, tungvantruong"
491589,"thomasdk, john18208081, roland3692, caryn8114, claudio1490, david5298, margaret2852, anita7459, billykwok, willy, andrew3755, P2PPerpetualFund, springfield6261, moz, max5129, art7961, mieke2220, dyanne41286700, shane7581, sts323, terry4845, elaine1609, jasmit, caspar2154, pam8941, pam8941, andrew2537, diane1040, andrew87793524, imaculata8795, chris8115, marjorie5511, ernst6198, vasyl9038, chris3133, federico8658, yvonne2828, bob9257, sunil8930, chris3570, wei8758, schaschon, samuelmellick, brian8926, corinne7199, emma3088, trolltech4460, andrea1421, christian5252, gillian2438, jennifer93652353, duane3590, jangoyvaerts, gooddogg1, michel7130, decarepl, robert9588, brianshicoff, katrin2989, jim5374, shawn9091, shawn9091, scott7662, lee6515, jensdamsgaardvanar, Oliver10303, erikeidt, james3002, ray12491432, stephen1825, john9364, mikeclay, patrick4677, beverley1074, david9063, david9063, jacob4856, allan8438, eric3281"
594634,"thomasdk, susanandmark9760, ed8114, ridamar8781, sonia2789, artvelva6390, nancy3352, yoichi1259, porter9696, richard8142, michelleshaeffer, mike7304, janerik7395, janerik7395, janerik7395"
47915,"ben4129, sherryl1377, harry6580, heatherberry, wayne6404, donna7622, melanie4212, nancy9582, linh2929, susan8470, claude1538, kathryn1621, ryan2502"
208563,"richard8716, nathan2230, sri3570, davidandmichele6643, anwer9451, patriciaandrobert2317, scott8769, christian1370, andrew3227, dimitry5642, fdarjanto, friendsineastchatham, jooatade1804, grahampaul5171, rockysfamily2223, exsila, johnw, jerry2991, christian9909, sunil8930, sunil8930, kirk5813, dawn2029, kathleen2217, kathleen2217, greg6014, pat9154, stephen4067, bernhard5866, harald3404, timothy6828, juanpedro1872, anne9441, gale7349, kim1986, pietro8403, thomasvincent, allison8667, harry7457, charles1181, judy6316, renewedmaterials, renewedmaterials, terrusse7349, dk55773, geir6246, jean4710, joe3355, doylefamily4254, missmalaprop, kyle3916, gregjakki6040, trolltech4460, gregor3661, larry2573, laurence2934, jonathan3679, gooddogg1, ronald5800, marc8568, mark1749, arte58085538, mary72353406, eileen2426, colleen7162, barbarac4396, paul9001, tk7333, dcodr, forrest4348, david4755, skumarweb, victoria1220, lynn9803, vladimir1150, dancohn1, anttim, charlie1085, periago, maria3425, stephen4750, dorothyandgordon4796, bill1367, edward1325, ted1533, monica8075, fergal6255, adamk, marco4123, akawesley, katherine6475, ed4917, maria6319, maria6319, nikolaj1000, eugeneting, Snak, tom9824, tuniaerik, wayneanddianna7853, chris3957, carlgaywood, mary2327, carlton2329, wbt112, adam42014654, christy5956, lynneandjohn1435, trevor9269, ramzi1441, joao9272, mats1256, jennifer5919, bernhard8765, darin9858, havar5047, appropedia, chris8107, hazelb, paul2084, karen6116, joakim3817, emma1769, lauren4033, janet8995"
303817,"luenda9953, drdeena5042, jennifer21394720, chantal9688, carey7726, laurence5353, susan5084, giftstograndmothers1386, robert7051, artida2536, sandy7802, gooddogg1, marcbrands, ty1305, omar6994, airlia, gretchen46044112, tito3311, brenda2899, jelenajovanovic, alen2517, haraldandandrea7370, randall9423, kimberly2776, sandhya2698, nicole5949, jeff6906, amy9811"
105286,"rob4541, andrew1065, vinessa, davidmargaretand5150, sri3570, david3104, ulrike5921, lydia3852, amyandclasses7912, yuan1925, Pedr0, jake5567, jacques9175, david8345, thomas5096, shamsuddin, mary3250, azinm, bahman, scottandkatie7649, anasofia8190, karen2353, desiree3475, arcck, amanda2800, FrankBliss, will4892, tracy6132, kevinrehmer, james1252, speakersspotlight3773, kimandwayne7444, dave2993, linda2807, Tati, cecil6342, wietske9086, spencerandfamily9309, joel1601, joel1601, margaret8937, laurence5353, vikki6178, jens5308, jacqueline5692, suzicatherine, jonathan1111, keith1347, toddandmary7322, azizah4210, stella9434, andreas2382, discomacho, joe1328, sandra1413, qandil, mohammad4936, BettezFamily, tyler7579, brian6571, nyakivaclub6812, adam5414, jemby7766, hendra2354, korbi6126, camandtiffany8426, sue2273, paul7935, dalem1569, adam5394, ron1639, mahmoodhassan, lenandpat9102, lena, ken8682, sofie4732, rebecca7728, patrick7181, baha, ikaro, ahmed1768, ahmed1768, cindy6438, ranjith1413, houman8896, william1402, beck5232, glenda3398, takbiir, DianeR, salman, vasiliki, deepsky, deepsky, deepsky, deepsky, george6664, tom8613, babak6368, hafsa6734, uhskivaclub, todd7596"
154951,"susan87052431, Birdman, vijayandtripta1646, sassan6670, kirsten6933, gary1844, liz8549, trailsendmemorial3322, john28949634, kat4193, scott8628, rogerandirene1929, michaela5978, storks, metin8315, majken3531, david7714, steve5603, teich, hal4188, annette6883, eva9695, thomaslingard, tom4491, michaelandlee9845, bob7139, ramsey1866, nuclearspike, clara6873, roger9971, jacques7602, kolluri, matthias8454, thomas7482, ken4364, ron4762, thomas6668, alison4606, al1898, paula5259, johan4776, jillian1643, nina2471, jonelle4661, camilla4622, james2846, veronica7602, elizabeth8689, alicja3520, jonathan6712, caroline1392, carolina5863, justo4288, gooddogg1, tom7497, jose1666, ulrika3518, kasper7063, david1477, jose8133, lauren6982, pbwtrentoncanada1627, zoe8568, aja9354, lorie7953, khatnyp, amanda6437, femmy1373, stephan4020, wayne2972, wayne2972, amigosdedeimos, jackandhaley6405, michael9272, fran3621"
511988,"raul7008, sainzcar, lee6682, lee6682, lee6682, ah5200, filippo9789, filippo9789, alice4026, shannon9663, gary4344, rob9528, bob4739, bob4739, bob4739, bob4739, jimish, romin3340, ann3351, jill28396106, john59229829, john59229829, alejandro5210, andrew8575, nikaso, tonyandjessie1677, margaret6784, jaco2515, donandkathy6425, adam7065, jensdamsgaardvanar, somysinghal, murali4089, adam1607, ray12491432, theodore2881, theodore2881, theodore2881, theodore2881, eugene7557, gooddogg1, karen6436, maky"
216077,"jennifer7124, barbara5610, daria6322, brian8446, alexrudloff, manan4248, torbin6204"
494488,"thomasdk, lydia3852, sistersofruth9926, martin6956, runar6676, roland3692, candace1215, claudio1490, thomas1791, hugh8488, hans8409, michael30159157, johansindra8851, franzi2262, david5298, suresh, margaret2852, tanya2648, P2PPerpetualFund, giovannicataldi4083, brie5458, sue4453, bmarar, bmarar, carlj, sonia5424, aidan8373, andrew5306, marty6935, ingrid8596, les7953, pryor2007, thomas6650, john4190, tim6823, fiona5750, ramon7201, jacopo, jean7740, jean7740, bramw, roger1977, elizabeth5209, aaron3015, mark5535, kc4880, cheryl4075, chris8115, rasmus7365, martin1464, wes4465, barbara9933, colleen4487, grant2308, lisa5536, sunil8930, lesley5450, mark8775, vicky7746, janed4748, michael46177363, jensdamsgaardvanar, shree8053, allison35118992, schaschon, doug7962, sergio9273, jeffrey6323, janet2220, janet2220, janet2220, fabio1365, nicholas2876, edvardlewis7130, teknologiporten, duane3590, bradjill, stefan2222, geoffrey8660, elizabeth9652, marlene1126, ymotux, OnlyUno, sherene7552, naveen9379, ray12491432, stephen1825, mikeclay, mikeclay, mikeclay, terryluette4913"
593011,"rob4541, trevor2024, andy2414, thomasstanley, tom6670, archie8832, harold5454, merrittsse, benjamin4734, juan4183, michael15052813, benjamintironenunes, sina8521, alexandropalmieri, guido8091, poverty2prosperity, kevin2282, chris62705651, bill9627, kimberly2105, mikeandkathy4228, bouwinabeintema, brian8859, gilbert5555, jenny6349, mg6010"
229204,"richard8716, maryemily7772, gerryandsylvia4525, robert7871, mike5486, geoffrey8660, arthur4871, dianne9893"
298213,"dougjeanandlexa9343, jeana8583, kristina1073, kristina1073, vernon4221, tlaurie, glenn43559655, alycia6842, david3432, david3432, Nikit140, paul7344, eleanor9941, kimberly1142, ruthann9513, lea6459, scottleibrand, craig6236, ayumu8251, otherworld, david7683, lee8088, nancy6940, linda6796, funkymonkey4439, globethreeventures, thomas4171, barrie7327, operationgroundswell, operationgroundswell, operationgroundswell, operationgroundswell, operationgroundswell, operationgroundswell, martin8406, mouchicchoc, tom7881, elizabeth4499, zane9551, kim8007, jeanpaul4526, jeanpaul4526, sarah4174, judy3495, moira3481, aaron9883, nick9872, sue8513, christa8363, robert30127055, edwin9300, jim7882, weston3103, midhurstunited5547, cathy2037, marion3166, kim7443, rossching, girish5569, cpaleadtroy, declan5722, zach4886, stephen3863, kathleen91508601, vanemden, hashinclude, lisa9511, lisa9511, james5557, joey3823, kim7717, SanjayMehta, michelle1561, diana4594, bobharris, paul5577, anttim, phuong, tiffany7563, janice5423, mark3252, peter3613, nora4883, megdesko, andrewvrana, michelle9107, johnburroughsschoo2788, NoemieD, whbc, ramit, fredrik6879, mark7876, mark7876, alyson3902, carolyn2231, laureldon2965, roger11905654, harold5997, daniel98469874, alessandrorossi, benjamin4990, rafe5539, caroline9023, joshua2315, nanites2000, ernie2062, christinabenkert, trolltech4460, hanne7225, ellery, teknologiporten, diane1068, glennandsonya, mark5816, laura98185199, carlos3985, arthurarnoldmsme3019, gooddogg1, nancy9113, evie7813, jamshed9850, christianhultner, annette8051, nyertun, larserik7930, shirley7434, david5071, david5071, david5071, david5071, inflowinventory, ericandjoanna8401, paul6044"
319643,"xavier5432, patti8773, susan3377, marie2914, jan1583, austinlee, davidel57, john2387, jonathan18184035, robert18976808, robert18976808, juergen4168, nancy79325978, kerry9471, luca40347333, charles4904, philip4082, nikola2686, peter1001, kim8689, steven39066833, jerry4953, maik7956, john40686234, pat7962, albert9241, 0545998, peter91094258, rich9154, mackenzie2005, barbara98752777, vilma2743, pam6555, steve2965, stephen17592794, lauren1840, ashish4482, kivanewyork, shelley4422, john61636855, john61636855, del4231, nira1920, carol2143, craig4455, yannik7122, epeter9592, roberttoos7477, Ringstad, marcelnl, cruelraspberry, zak1760, michele4695, mike53265545, fennerjw, gretchen9779, frank8042, jmbranum, c3kelowna, konomike, ivar1679, william26708089, brenda7778, yaeli1341, liz1293, rui2300, daniel1290, ejo, mark8950, lars4584, avivaanddavid9794, eric5133, simmonsfamily8580, annandted4662, warren4957, nathan7771, spencer1164, hester7335, melissa8553, mauro4430, ashish5575, darren2502, mark8896, stephan3730, chet1474, gooddogg1, howard3593, charlotte3549, katy1650, saitodaniel, davelevine, dayna4539, graham1284, graham1284, niles8097, david8628, gordon9461, james1252, moundsviewhighsch1719, wallace4654, eiliv5100, jim6323, mb1247, carol4181, russell4728, luke7335, shawn4618, indubitableduff, james1948, kathi2304, sandra6034, craigandmary9443, frank2817, savoycapital, steven8434, caroline2780, JChMikkelsen, peter4002, leesa8667, kenneth4702, robert9588, lindsey1299, charles6013, cindy3594, arnaud1511, joe5552, charles7380, james7288, creekside, lawrencemanyiu8409, annamaria6004"
358129,"roberto6342, safiatou1275, luann9196, charla3954, michael7877, nancy7311, ramona5141, sandra4110, paul3517, nancy7389, christine2884, kmix, lori2019, john26306739, gina9212, matthew5459, don2055, don2055, hakayati, r3922, kaley2889, pauline9167, megan7285, susanne2305, kate4058, katsutoshi9441, sandy7982, joe4820, christina4738, raymond7897, chris1674, jannett2123"
312598,"thomasdk, neil3391, sri3570, roxanne3684, max7242, stephanie77316363, annika9099, komal9369, jeff2523, auroa3919, david5298, scottleibrand, evan1536, EnisothaFund, carolina50289587, bruce3510, brie5458, william9404, lee6682, eckart9096, eckart9096, toni5288, shyamthimmaiah, emma7614, adri4414, emanuela1013, cindyk1959, andrepax, pierre4193, pierre4193, chris8115, stephen3863, kate3383, gordon5050, luyfkug, mazooma8410, gooddogg1, susan13668824, wendy62034717, mike3242, GoodVibe12, matt2356"
96187,"PKBanker, MarechalFamily, jacqueline4998, patrice5750, ianellenandheath1605, jimmy9473, una9290, haven9682, nils9902, christopher9942, ann4180, peter7281, norman1629, shawnsutherland, rich4990, doug9822, brian9877, denis9948, michel2582, henri1794, jack3433, dsayer, goodstripe, giorgio6510, ghislain3985, gary9229, steven3253, robert42232897, and659237, thomas8855, michael1441, zak5402, danpearson, stephen3128"
84109,"marcella4006, emma1696, anne3147, kris4084, kathleen6455, joe6124, nancy9040, nancy9040, marilyn2486, anthony3119, YOyoYOhowsDAjello, joel9767, carol9239, ann8271, james4635, lynne5519, bruce7238, john7862, leron1102, leron1102, christopher9942, veronica3547, cynthia9214, gail3412, gail3412, klausandbrita7811, bud8447, charles6384, adam2917, esteban7737, jamie8963, gayle1434, gayle1434, justin4336, jennifer7510, dinah8871, jeff4748, liz6706"
168817,"gary5642, lushfan, louise5599, irene3029, martin6956, kevin6221, masataka5443, frode2030, feryl2658, johann8319, kitty4165, lee8302, natsumi4535, steve3316, elizabeth2872, keith9642, michael1455, william7215, kel4408, bohica1992, jyrki3381, fumccoppell, lawrence1939, rebecca2728, hanneke4317, charles8207, ingrid1384, hjortholm, kivanewyork, karinmarie7716, marc4972, raymond3409, lelon7551, storks, likai2551, michael5977, arjan6669, tatyana4594, envy, yonet, annemarie9907, steve7075, micah8727, phil2131, sarah2583, jo6131, genevieve2127, william7018, nancy9592, ronn4961, bill5102, drdul, baltazar2151, thomas7482, solsticebahamas, antoine9013, benjamin1539, shlomo6750, bert8201, gooddogg1, carl2627, greg7477, greg7477, sara4553, acelle9394, paul98448449, jillian1643, cynthia2510, ReliableIT, winifred9605, angie3098, barbara5218, david5670, expatpat, stephen4067, jim4563, david57626954, brian2052, brian2052, rachel8308, rachel7520, david62035638, monica4206, michael7986, Sonnenbad, harveyandcarol8329, franz9546, kim8007, andrew76328498, fornve, vijay1946, fred3741, healourworldproject, rita9769, amnesty144254, barbara5174, PatrickNeuchatel, jon9875, will4589, skye1434, rod5684, maryhelen5678, alexandra9167, yukihisa9409, tsuneaki4579, bennett1318, david9752"
465746,"philippe2255, fred7887, fred7887, acheng212, melissa7191, jennifer85053780, aaron83574977, david72891233, JY1024, craig6200, maia2211, jacquelyn8289, alexzandra, billandshirlene"
573696,"bette3942, dennis9163, sustainableequity9628, andreascott, matteo2046, laura8059, greg3464, janel2765, marjorie4354, markjrodrigues, andrew2066, marya4071, russell9818, jo4197, rebecca4187, athena6426, debs8578, suzi6265, claudia3062, linda4162, migs2670, alexander1835, tove4710, mary4373, robert5348, vasu6972, molly3537, jannis9788, prabodh5470, diane6096, leslie8320, carlo9232, bernhard1113, jennifer86293639, rie6860, natoya4299, krauspartner, tracey9969, heidi9127, sandy3893, 25perday, ali91125852, angela6286, natalie16922915, matthew64195818, brooke8026, paula3738, catherine8081, janr9603, jivan3702, michael66234053, janandjohn, michelle7526, theresa1218, carly5390, sarah30963630, michelle3865, premal, leslieinjapan, jonasb, david7193, simon8263, sheelu, jonathanheather1555, erica7803, andrew2954, ultrasara, john36421277, mariliis4011, renee8611, leanne5754, tim4058, sudds, jo8468, christy2688, lindsay3373, jasoninchicago, jenny2529, frank3452, raymond4538, rob6883, kartik7352, alison7005, vanhara, vanhara, webwidejosh, adam9629, cory7540, bryan8244, craig97299604, alina3712, corinne6438, kimberly5146, jon9748, peggy1697, maryanne3170, verodreams, kathleen8713, jan6672, rachel3298, sarah83079025, jodie4413, kathewelch, dafydd23, charlieandsheila9534, spencer6921, toniann3989, rene2905, sally8048, katsujiro1653, jennifer65476046, lodder, riccardo6220, jerri4708, ezra1813, frank33437545, kate7671, hebe8552, susan5374, jan2206, scott8438, jjakmides, christine7497, allison8914, marrilee5290, john52023372, james68166216, jan92, mlanie1854, carla2983, joakim8782, arealrattlesnake, ellen4684, laura1416, dan66559622, cate4432, shirley1905, barbara5987, alexiosstefanos5966, lorea3139, sean3201, carol87577825, melinda5249, brenda6572, mitchell4909, angela7865, thierry8170, thomas3406, dede5082, giorgio8831, joan4001, serah7726, mary9011, mary9011, edwin9878, katalin1762, nicole94062489, nikaso, adam2571, alwynne3021, judith7292, beth23368995, lisa6202, michael58722678, jesse3022, jeanne3277, rain9931, christopher4551, leecarol8813, kate8166, tom1199, joacim2931, bobbie5048, alison3893, julie3027, brendan1249, antonio6568, beverly, creativeeconomy, james4890, xyz1373, caroline4851, mags6440, starsknight, joanna6771, dorien8995, natalie4612, peggy1370, luke8286, chalanx, unitarianuniversali3384, rini, joan3580, joan3580, elizabeth6283, alicia9917, jon5113, roefamily7690, ivano4041, oisin3389, dahlers, laureandnathan8538, laureandnathan8538, benito, boaz5464, leland6915, anonymous20200701, gunhild2246, heather3523, caspar4036, julie8344, karen1536, andrea4458, lothar9237, jim3962, deborah4135, michael9752, jeffreyandannegret9319, douglas3301, steve8782, marion2587, judy9116, alice8507, shane8924, gord6319, linda2624, daanial, annetteandtim9579, arendanddarlene3111, alison1210, heather4452, jakethielen, clara3321, chiapei6968, christian3795, ignaki, greg2708, burkhard2424, caroline6735, behnaz1023, jeancharles6948, nicole4331, paulandkathy3332, mohna1104, libby6618, joan6214, natasha5785, becauseyoucare, max1495, anne9124, john5744, marthaandrobert8020, karin8006, june5576, pax5524, jan7030, zen7998, chad1043, hisadafamily8666, lauraleong, jim7785, thomas3791, thomas3791, julie8037, maureenandbill7908, joel5645, leeann5973, derek9183, stephen7228, timothy6485, sandy5828, tim4819, stewartandjoanna6718, albertw, timothy7790, wendy9105, roxandal5758, gustavocpimenta, joann9259, william1104, peeta5736, tracy9170, eric3465, diane5157, christina1088, john6732, debra7424, nelson3926, haitham, suthi, ajit3049, toby1460, beth1817, dawn6170, michael64749969, tfrab, christopher38035375, lloydminsterrotarycl6639, julie9582, lorenzo7127, jeanetteingrid9958, mohannad, mayo4304, gooddogg1, mary5891, susan6148, john4502, lynda6318, elizabeth3512, edith6098, joshua2603, cedric9771, john7508, andreas8709, adamscottprice, wilma6195, nate4569, carolyn8576, kelly31908638, brenda9272, brenda9272, mary3259, caroline5418, caroline5418, anush6731, mel7714, vladstan, leejohn8697, lynn5475, tanya5801, patricia7040, kris7164, lifeinamsterdam, stevenandrhondabill, meghan2393, gilberto7688, jonathan6863, roman6673, laurie9583, laurin, frank8142, kristyn3371, elin4402, asparagirl, margaret9763, chrishess, megan3093, john6739, nick9822, louai6934, brian2016, wendy4343, austin1984, jaclyn4676, louise1987, neilthanedar, wendy5056, kate4058, cathy6947, tonyonkiva, casschristine5146, kate3357, vito8085, victoria2140, agnieszka6878, susanandbill4911, jan8763, richard9693, cgull, rachael8906, barbara5078, thomas8970, victoriusvixen, helen5675, helen5675, darryl7606, graham8286, l2253, andrea7380, bill7224, kat5475, richard75689996, dee1355, jaycassandra7756, simon2264, jeanie1305, jerryann8089, magaliefrance6900, helge5511, cyn5646, tina5592, bill8400, larrychris1406, thomasgraham, heather1546, nadiamir, nathan4355, chad8960, angela5969, suzanne4305, mark4564, porter9696, rachelle9002, leslie4054, karen8054, sandy3287, ben95621346, andrew5018, yoram3554, phonse5983, david77732635, normandmichelle8811, howard4754, kevinandkevin5061, jimandmaggie, tedandalexann8840, david64376525, james80465004, amy7407, jorge5645, kyle9253, laura4210, shaun3027, kara5723, krisan8949, johan4746, zan4576, karen94096564, becky4310, eric9311, svuorela, patrick1624, melanie8694, mattias3342, julie5398, federica3226, tomsve, richard57583833, richard57583833, marc9650, dirk3138, kristen5008, barbara9916, elizabeth8027, chris46268725, sheri7214, amy3374, linda1271, tobias1865, glenwood3349, riana4549, jasmine3207, annanathan8608, nadia7033, gita3182, margaret9831, momo6724, lindsay3666, ehsan7185, samuele5076, daniel3909, robert15604613, amina8930, michael89852871, sarah7173, gravitex, nancy1864, drem1641, massimo4704, elizabeth9621, virginia8803, ruth7034, yuri7211, yuri7211, fayeali"
