LOAN_ID,LENDERS
1885154,"mary9680, jennessa9530, rachel8760, cambiumfoundation, martin2308, olivier7963, pranavkosuri, nick7957, colin9254, rosie2233, anon23456, carole5636, dickey1613, gooddogg1"
1887348,barbara5610
1885736,"william1495, marguerite9079, sanjiv6738, lidia5529, peter1904, dirk4795, scott1546, nirmal7290, ryana9900, raghu4281, annedavid2645, shore9831, tierata9432, keith2194, anonymous5138"
1881926,"jonasbbg, goreal, enrico9804, dinah1488, wakibi"
503495,"jane9828, donald5571, patricia74974832, graciebabie, gerald4403, miguel9664, miguel9664, steve43344810, kathryn6720, charles7179, jim2904, ted6954, jennifer7646, elizabeth49077548, jean6362, pimi5354, charlene4773, charlene4773, sarah4632, christine58763134"
572677,"jane9828, francoise2447, mario5479, angela6286, jennifer7596, james5204, lowtax, lowtax, jean25656959, ashton2206, vxahu7945, timothy6761, libby1013, andy42, katharina3393, onica2022, themissionbeltco, tracey9031, cecilie5273, violet6173, gard4506, allen9984, peggy9669, peggy9669, carole8281, kelly8291, courtney9539"
235898,"sinta1986, stvshn32, kathleen2383, mark88996729, mark22209299, ian3357, michael6621, TeamLOTUS, debra7429, alex9701, artur6344, joeD, kendra8468, shirley7225, hillside6128, hillside6128, yongsai8212, william8327, marianne7409, alexander6527, martin7271, karin4195, nate9499, betty1240, candy7249, camille7563, stephanie9082, fredrik6879, jon4882, dianne7737, steve8459, donaldnordeng, adam1579, kiml3357, megan3378, james2384, trolltech4460, steven9748, michael8718, axel2171, natalie2181, alyssa4436, andy42787631, kurian2487, dan3878, tobias8402, tim5467, nancy2716, ngawchee6402, denice8934, denice8934, robert4764, michael1327, nuclearspike, ross6693, patrik2584, don9212, matthew3278, yoavgit, davehansen1501, thomas3596, maddy4412, jimmy9473, twain7108, aron2821, columnex, stephen8688, greg4270, david9841, katie1276, dittes, christiana1622, vestjyde, schott, MarcoSposato, george1179, harold5997, uuwhatevers4707, uuwhatevers4707, chantale1214, katekelly7445, katekelly7445, stephen63961705, linda1010, linda1010, david3989, david3989, terence6279, terence6279, kathy1783, laura4960, jon9875, scott7776, mitch3683, kaoru1687, lorenzo8161, joaquin5504, lee6515, kelly4460, shree8053, anna2869, jack7020, jonathan8833, william71289474, amin3839, jennifer8985, michellehight, patrick5248, marjo1748, scott3518"
142873,"uday2078, jamal5684, munawar2960, munawar2960, katherine5733, francisco4283, christopher4445, chris4881, liam7181, liam7181, timothy2169, ward1831, ward1831, don7422, nadia1234, benton, kamel3768, jeremy8755, ian7566, naomi9836, naomi9836, ramzi1441, mike48519820, jason5878, jill4935, lelon7551, ammojohnny6934, patricia99392365, ramosl, steve1451, steven3253, gina8440, stephan1950, carolyn6272, phyllis4195, gooddogg1, mark1749"
496448,"richard5158, peter3297, steven6854, ian3357, ben7239, ruanvanrensburg, rebecca9786, isameer, clinton5134, tyler94669861, justin4823, justin4823, dirk6193, kamil1573, sacham, tim5775, nicola1093, tony5558, lisa75891439, leanne1462, ben54132620, rob2604, meilby, dane8136, kevin1460, kevin1460, mouchicchoc, alan1329, martin2575, zane9551, james7271, aerin6593, mike76198005, pallesten7541, rebeca7244, rebeca7244, harold5997, harold5997, frank6812, inger5309, ajmushi, ajmushi, bernmutt, howard4162, barbara5610, dennis7511, gauthier9913, janetsproutmemorialf9549, janetsproutmemorialf9549, joinFITE, kara4884, dermalogicafitecanad2401, julien8044, kevincollins, guerrero, am3914, maria4142, heather2233, marcel5216, peder4607, peder4607, joe8196, kpalmvik, charles2923, bernard1605, bernard1605, ethan4894, tom9288, tom14875578, lisa4170, helen7722, lsanza, amy1662, rebecca3499, lucas7558, david7683, srinivas6554, craig6729, martsrinandpete9620, eloi2904, bob2356, roberto2458, matt5508, lawrence1939, joel1234, joel1234, dcdani, michael52425695, joao8850, catherine5629, kanan7936, mary9576, terry1191, nidthiac, ryan7174, sierrafoundation, sierrafoundation, tom1045, horace7444, patricia9412, james9997, paris5257, justin6036, francois3816, breda5201, kivaatconferece1990, barry1291, rneiva, janette5109, codybringham, andy7574, andy7574, ron5173, emofund, trolltech4460, mark6772, dave3999, anita3459, marketboomer1541, madeleine6475, SamEllens, kizaemon, carol9994, ian8279, jamshed9850, john4756, robert6018, randp, vic5854, julie7676, cruisecompete, bobharris, roland2980, sami5927, anttim, john9455, larserik7930, ronald5212, paul4243, mishelle7564, tom1596, hans8594, holstee, sasha5877, bill2399"
390084,"laura7086, garryd2031, dawn5259, ann8055, michael1856, jennifer86293639, paul6095, james8691, christina4281, moonbear, timothy3676, francisco4283, mouchicchoc, kathleen6406, hannah3770, david2684, nbtacreditunion2871, saraquina, linda6761, dana8772, jeff3070, robert3128, eirik1842, guidostruben, stephanie3863, alice7944, marsha4330, mark7719, colton2410, tarunsethi, robert59061674, peter8719, trolltech4460, edith6098, kylac, chriscooper2050, owen4319, jan7923, kirtapatrik, chiieng9764, laura4058"
404433,"jacqueline1998, dale1927, martha8340, martha8340, pete6004, sboss, WHYu, leena5601, john43771013, michael5039, lennart2626, lennart2626, eleanor1631, matthew8416, maciej3797, radomir3258, grace4027, amy1300, amy1300, nina3497, christopher7857, eurobilltracker, jenny9449, jane4481, royandkuyo6191, steve2288, cubbage, amy5012, bruce2043, lesquennevaisschoo9852, kohmei, jeffry3064, patrick1967, enredados, enredados, robert3128, david65806349, amin3839, susan48757262, robert6811, jangoyvaerts, gooddogg1, gail4881, laila6594, tony5947, stephen5987, charles4234"
300574,"jean3667, christina1393, gretchen6007, ann7786, pryzym, theresa2692, dena2065, lisa2935, janet6680, petriedish, anna4895"
598984,"donald1958, john87783466, john87783466, wakibi, alandpat1463, gordon7972, brian5281, wardamneag1e, mahipal9230, dan9156, mark7436, KevinFink, nils3477, anders4368, rudolf8006, stuart7599, george5908, george5908, ronald2997, benjamin9324, john37481062, cheeweng4729, donnie3455, kristopher5713, adam2009, chris7727, jonathan3441, graham61139633, graham61139633"
65782,"donald1958, sophia7288, ken3530, brian1008, mark4241, hugo7632, mary4420, carlota5502, mari1056, brae2942, mark9519, cheryl3553, holli1777, ronanddenise6108, jim6777, linda8513, kerberos, gillianb, kevinandmikayla9588, markgrimes, dolly5570, randy5533, cheryl5993, ramon, pomerleaus, emanuele2274, robert7616, nazaret7843, eric71017982, dora1651, paulo9048, silas7582, carol6947, miguel8271, albert5438, philip4682, chris8115, julie5260, baxter5958, pam5223, marcandnikki1445, vickie3062, lauralee3959, marilyn5865, nick3133, dennis1968, julia2193, dyk7776, roger1977, 1396, david8807, josie5606, myra8710, janis9700, jonathanceinwen, simeon2328, michael68631679, mark5729, gooddogg1, lily3082, bill1492, tom9525, michelle2959, molly9413"
80410,"eric8177, amy5012, festival, sisteranne7859, ingev, mardi2610, alnore2950, aghdas8531, peggy5678, johnandkathleen1292, saralyn1589, jane4802, morten9445, christine8061, bobandjudith4623, lurker2, barry3277, brian2764"
72368,"jennifer3414, mandn4700, don6498, jacqueline2836, huron6952, beth5286, trey1408, jcandramona6964, kathy6631, sammy2395, kerberos, gabriel7223, aaron1855, nam3555, mary7267, dylan8461, barbara2085, bandk2523, margaret5948, tom1928, jill9861, siljeogoyvind, cleverspenden, cleverspenden, gregory6516, sherron7977, gregandclare1849, gloriaandcal1717, don9342, jean6230, marianne9035, chrisandsara8294, bob8884, aneta1719, jennifer4821, dale2912, marian5425, gooddogg1, rashidmayes, bruce2500"
35570,"jennifer3414, peter5367, chaz1376, markandkimberly8281, drjaime5855, sue4959, pat3838, bernice5340, fredric, wesley7260, amanda1176, patrick8975, tom5270, karen5117, Timoti, valarie8429, Snak, michael14567121, richard8195, don4042, robert3664, stephanie9302, kathyandsam1854, richard5261, smallpotatoes, carsten6793, mark1749, johnandkathleen1292, robert7176"
84355,"roderick6916, chris8434, mogens6515, james5854, mark8536, virginia2824, doreen6166, james7218, nichole2383, debra1882, markcrooknz, johnt, joe4177, robert12693983, kevin1789, kevin1789, carole7565, nicole8646, petriedish, robert3697, patricia87991204, linda8066, kay2394"
514667,"paul7188, eric4448, mark3556, george9366, artur6344, autumn3323, thomas1126, vipul5419, rubenkwast, FTDWS, bryancostanza, benjamin3924, benjamin3924, jennifer4821, rae6734, michel4293, szucheng2565, zachary8135, moz, bmarar, solsticebahamas, raffi4065, kcs, johnandelaine2040, john5936, oliver6471, miriam9301, james6805, bettina4351, familylaw5408, wilhelm3922, ilsc9329, ilsc9329, dave3488, judy7940, rajko2834, daniel4, peter3606, taramora, joyce9102, jeff7742, james9997, jon4016, andreluiz6163"
467804,"mark91758344, partalis, dominik9236, dougandbijal3377, claudia8977, paul7034, mario3397, lednev, fraterjason, joshua2315, johngreen, vivian1363, jesper2017, david61147624, henry6700, michelle1669, brian3854, brian3854, brenton8195, sarah70983093, coral3993, trolltech4460, michael9717, david6950, pip, pip, pip, victor8828, olli7135, grywht, brian70929942, jesse8655, simo4855, mark68886512, tom7310, tom7310, steven3253, trondatle9355, douglas3523, hypnosistrainingacademy, dinesh8915, henry6700"
304317,"sarah3052, jason6815, glenn2609, hobophobe, ronit, angie6388, power9651, christine3899, kevin67543760, ambasgeda4324, jennifer5072, luis8823, stephanie4780, peggie1789, natalie6325, darren6503, laurawhudson, janice2374, haroldandjulia5731, robert1992, lotte7588, kristian9598, larry5392, paul1072, anniematt8914, debbie8640, dinah, james5748, trisha5187, susan2215, elizabeth7716, natasha8897, mohammad6734, nicole5134, joe4799, alexandre1322, erin7876, katie4123, keith81881190, lisa6311, mike5585, victor7349, victor7349, robert1131, joe6347, bethany7354, jennifer9922, frankali, anne8071"
303791,"katrine6873, margaret7041, pat8621, pat8621, jessica32704686, randycolbert, barbara3145, leah7912, sandy5656, holiday6306, judith1609, jorge1728, john43663971, suzanneandryan7614, zackmack5627, bobbi1476, robert96801959"
205169,"mette3464, syedimran, bobandcarolyn9416, anoxmusic, patrick4072, salome4693, javaid, robin98498841, craigericazeke2192, jon5113, grahamdbrown, mark42886525, william3579, omer2195, doug9369, justin3174, thomas3583, russell1674, vitor6919, kristine3890, tresaandsteve5512, tresaandsteve5512, jeff3131, emiliano, nick2889, thirtydaychallenge, cheryl5353, john83632384, george2975, maxine4413, susan4752, jeffrey4450, jim3451, peter1715, tomandjudy2457, jutta1859, robinho, dana3185, christyramsey, micahchiles, emma4595, danielctaylor, martha7295, stanley1542, cindy47683377"
262386,"mark91758344, randall1484, alessandra9388, hannah2362, mary3624, subashandgita8317, laura32244728, frank3457, greg7201, jorgen3410, peter9617, krista2966, lisemarit5656, marilyn5940, ruth3997, kristen1731, gil1353, rob3672, petter7849, peter4339"
222505,"lawrence7308, ken4527, goncaloepaulo4752, mary44222430, tammie3142, kelli8511, mark3863, joonyeengyo, lars7438, stephen41492917, stephen41492917, darrell6229, rolf5220, benton, linda12298289, erick6244, sara4873, tracy8326, mrk2028"
37747,"steveroh, trinh8499, van6270, peter9169, naoyuki1863, kevin3889, rebecca5706, kevinandpam8837, lia2066, priyaram, jacqueline8803, khayam6592, tomanddiane5575, oakridgehighschool4789, shun, stijn6554, tim7927, bill4265, asaf7378, michael2446, paul3975, hannu1045, timothy7001, johnandmarilyn, arad, william8311, russell2226, martinanddebi3826, patrice6499, david4961, loreen3384, athena8027, joel7474, brooke8696, jeremy1194, frank8569"
130894,"steveroh, neil3391, neil3391, glenn2508, glenn2508, john2935, emma6693, cindy3715, claire3348, michael1087, marlowe5858, sylvie2081, mia7062, meghanfair, daniel7955, neb9153, susan6930, hugo7632, trailsendmemorial3322, deborah63801465, oddmartin3934, tim6129, lnkeyclubmicrobank1325, gangmo7427, vinnylingham, giovannicataldi4083, thomas3400, jenleelind, art7961, daryl9981, kenneth6351, dan6332, dianne7737, sachac, darryl7057, noahandchi1416, joe9034, joseph3657, miguelr, roberto4342, tony9832, jeff5192, jane5219, rebecca1035, jerry8171, nicholas2647, leon4022, linda9148, richard6970, kalin4541, jack9008, jack9008, cynthia9152, ron2819, christian7733, pumpkinhead3d, joey3823, everett3453, alexander1589, samdaams, brooke8719, randall4421, ronald8745, stacy8077, wolfgang3771, tom32883974, roberto3605, will2015, Estella0211, william7215, mark1055, joan6711, atlas6495, carolyn6225, martin7896, Leah6742, altijdweg, nazaret7843, emil3577, laura4606, kertek, spiffydapper, joanne6368, russ6120, chun3169, justin9596, divingdoc36, unitarianuniversali7896, claire2020, linda1010, jessica3619, john8831, ross9493, howard4162, buchananfamily, brianlh, mollieandhannah5626, elisabeth1, michael3218, tamara4759, leif9873, william4369, DianeR, donald61809394, brad1778, scott9873, gooddogg1, elizabeth3916, adam5258, jennifer1679, wilson604, jeff26143261, johanna6479, lois6619, steph4133, leander2387, ulrike6938, touru5891, janandsiga, shane9898, cheeweng4729, stephanie3356"
90358,"steveroh, DirkLebe, willandholly9782, richard8069, annemarie7077, betsy8079, mike1401, mike1401, rd1499, jake5567, dandk8335, ian3242, meislikfamily, colette, calico, chrispadfield, richard9142, akrita4522, trogdorfamily7622, joanne1623, emilie4661, stig8573, karen58812489, lawrence4163, neil12983716, jillian1643, lauraandrafe6220, valerie5702, sergio6284, roberta5710, ambrad, chuanpow9262, dave6087, willnathan, levantine, john4190, rolandstuder, robert8715, stephen2637, alexander9446, corrinne3384, stephanie3376, peng5767, robertandruth8589, Anayah9514, maxton7930, adrian3747, adrian3747, adrian3747, fornve, marc8147, akarman, srenchr1931, grethe9210, bert2097, OneWorld, tim9512, dale2912, robert9088, donald3342, max5784, wongacom3393, jamie3222, markgrimes, markgrimes, markgrimes, anuzis, suraiya7516, louiseric, nazaret7843, susan7229, rangan9071, merlyn, roberta8271, michael3526, carlos5895, cheryl9715, adonica6792, kailea7313, ethel3873, allison4629, vesa1879, seananddominga1099, aaron3015, ken5992, glynis9566, charles2560, john2301, koshka, agreisle, mattiaslaven, ac8545, edfore, anita6984, greg7477, doctorchou, richard9831"
1884548,"utahna6196, detlef8456, elizabeth35497592"
1882183,"sheryl9144, mariana5463, rogier8420, charles6568, david17761002, jason8474, martin29242687, wakibi, karen1569, ghanshyam7893, saundter, ian4930, kate6438, nuno2148, tadashi2345, marthaandhoward3728, nicholas7241, william1105, dale2826, wpskolen, eric7248, susan6517, bob21598175, johnandmarilyn7070, stuart6398, sid2016, jason6610, mieke2864, lesley2366"
1885967,"joe8555, michael59798568, wakibi, jan3462, neil5039, van5229, mark5152, pekka9864, ross7070, gregw, hans8920, william53458701, poverty2prosperity, jeff6755, shroyerfamily2590, wakibi"
1875193,"stephan1448, nickolas, vamshikrishna, david4612, shikha1085, cayla5101, william58815515, carol7628, donnette5162, hans8594, camillo2802"
1874861,"karl7089, sue3822, claire51555866, linda28121909, alasdair3685, bryn9982, kathleen6579, dirkandfei8127, teresa6334, christopher12011224, sean60096844, cambiumfoundation, navid4599, flateric, bruce2063, abram8860, colin68, tashi2119, anonymous20200701, steffeh, karianne5013, hamish8276, leavenworth2687, david2873, geoff6803, sandra72778235, thomas8282, nancysomers, carl4458, arkbankcorp, poul1488"
1887476,"brett9497, jenny3234, marco6924, richard4986, merrie6827, june7708, kym6523, lidia5529, mathilde3817, karen72989067, bonnie3639, bertrand7490, ben8176, robbat2, howard4754, jodie5861, maxmakky"
1874303,"nickolas, ron8945, cari9459, antje29389224, huub4173, borja4286, valandderek2847, themissionbeltco, martine2488, juergen6502, hans8594, camillo2802"
1871004,"ike7764, lindazeretzkememor3742, jim8391, richard91063621, tony3623, dirkfei7073, gooddogg1, kalea3634, john43237142, dawn73798139, elma4658, stmichael5912, beth1719, tara6559, anne31187210, azchan, anonymous5138"
1883466,"ryans, anonymous5138, FrequentMiler, stmichael5912, chuckandnancy2911, timothy55691797, cal8533, helge6360, leslie5935"
1867134,"gooddogg1, sandy6796, arnoud9297, chantal2525, andrew44106561, davidandsusan9466, anonymous5138, kristy5453"
1884647,"ashish5575, andrew53616283, susan3422, daleforrest, kristin1459, am8748, konrad6740, gisela2380, cecil4832, ronjon9436, wolfgangfromgermany, howard4162, nancysomers, chez1746, bkhan4954, julieanddavid8556, helene3392, ian8249, jeremiah6614, deborah9891, michael88743666, janicef1338, graeme5179, patricia4592, williamhillebrand, wilfried2665"
1886806,"arvadis, BayShoreModelUN, anonymous5138, thiagolg"
1884681,"marc2595, andrew83608833, frob, zarko, holley9207"
1884709,"arlin, laura83009843, lynn6960, jim3691, lumi, tom3530, patti6260, kay7691, yann1788, michelle7546"
285044,"jeffevenmo, lauri1143, hellehaubo3480, fairspirit, burtonfamily3736, lauranesson, marco7367, eve4399, eve4399, xina, antoine8599, jaichand4140, avivaanddavid9794, diane3992, jeanne1490, jasonjodyalicelyndon, james3381, monafims, barbara1086, sandy6329, vibha9357, usha4134, phil7815, caroline9564, beth2127, alison6394, EGL, britt4957, lynn7213, nancy4421, nfhsmicrofinance, jon1550, june1023, david5901, david5901, david5901, syed1741, adam1653, peter7203, carole8896, rolf5730, kate2515, jeffrey8231, chriscooper2050, jonathan12849631"
293663,"tomandroberta1148, david2744, lynn5211, ralph5454, margaret2176, ashok3560, seth8920, tucker8046, jocelyn1805, tonia1287, tamar7888, john3926, austin8593, jeffcindy7925, andreas3674, jo9698, kyle6588"
118050,"AlanMimms, william0407, sandra3949, alan8357, semenko, andrea5765, lindy2474, richard22231073, adrian0656, johnathanmcclure, juliea9799, jayandmona4210, jensdamsgaardvanar, neal8691, ali9555"
59424,"hkon3014, michael3267, fred4276, jeff8410, david7383, emom, vcallisonburch, mimi1276, allen2932, trip7345, sharon4373, brenda1244, barry1362, abby6201, heather6102, laurel6167, penny8837, noah1547, terry9488, marcoB, jkwest, chrisasaurusrex, scrappito, elizabethpw, christopher1877, misobrinamayor, david32897196, erin9202, doctorchou"
99823,"punahou70887368, punahou70887368, punahou70887368, vicki2423, eric5436, stefan1727, luca4775, jeanne6749"
440016,"ellen7035, lisa7827, erin7420, simeonels1517, mark7039, paul75893028, aly1236, ken2187, cori4974, francois1223, jacqueline5449, jacquie6331, kim3048, rebecca4227, janetanddonna5176, brian3156, andreas8370, corey7429, alisa7090, erin5982, edison1615, jerry7327, jerry7327, leroy6821, ed4717, ed4717, inge4055, ingrid6602, mona2725, jez1184, yuling7031, yuling7031, leo8019, mark23702836, mark23702836, maureen5170, davidandjudith1988, roos9270, john96271744, johnsandberg, rick8224, linsey3388, heikki7953, liz3612, vani3612, maral9884, vincent3765, lucinda3416, nadine7346, olga5791, windermereunion6071, hidenori1251, susanne9174, sarah9861, jackchan, richard1164, olekvi, teresa5082, benjamin3155, judy7376, trolltech4460, rosemary6468, wendy2684, comitdedveloppementd7398, jfa, darcy2377, jeffrey3639, gooddogg1, blanche5888, rallen4488, jeffreyandpam3578, pamela2606, silvia7775, leopold3690, brian2774, brian2774, maria2524, laila6443, salahuddin3596, techsupport4812, roy1522, erin5987, adam4116, vincent8561, jeanfranois8451, jillian2192, oliver7216, andrea2174, kevin3919, michel2582, murraypriestley, marianne2909, urs4050, urs4050, cstarpdx, linda2705, ryan1270, palmer5527, palmer5527"
170892,"punahou5792, lynn7943, todd3081, laurie8847, barry1157, zorzellafamily3301, brenda1306, colinandmary5182, uufmmicro4415, bob20177351, david7651, eduardo8940, eduardo8940, janet7694, don9142, brian2642, sean7029, amish9832"
317761,"AlanMimms, peggyandcatherine7761, peggyandcatherine7761, kevinbryn, martijn2548, bill9445, sidney3704, vivien5229, paul2135, tom2607, colinandmary5182, thanos1740, thanos1740, sabine9237, linda2502, InternetSweden, kristin7853, frank90947348, antoine5746"
124417,"dana3947, elaine6268, gia4850, sharon1564, judith7001, phyllisandthomas1041, andy2301, nancy3385, ronald7244, karen5117, john3508, robert2688, swaitha4719, catherine6918, denisandlinda7855, david2410, merbo7219, nobla, nobla, tim1647, brad5179, denise9659, leif4954, agi1154, ethel4085, nancy5354"
190483,"dana3947, barbara1989, engstromfamily5682, kathy7691, merete7381, kevin6221, aidanc, theresaandallen5220, tricia7470, ellen7708, bernhard5047, lincoln4338, michelle1996, carolym5888, ron6511"
426802,"carol32657957, shinemurat5100, max5129, katharina9103, sandraanddiane9445, barrie7327, samuel5140, emofund, trolltech4460, zella7370, kcs, kimberlyjo6770, Justin20Crawford, jessica6460, jeffrey8114, kiwi, howard7012, daniel98469874, howard4162, gail6180, kohmei, vivian5464, amirali5409, jonathan8833, divingdoc36, laurie8580, mallorymcco, sidledes, sunit8814"
285281,"rob4616, mary2649, jim5915, shinichi3395, don9212, hmigneron, tyler9489, lawson6955, marna9169, gary7000, jaime9683, raj6529, amanda5605, geoffrey2176, timothy6828, anita7459, beaconheightscob1012, alnasir8218, richard5829, stephen8206, donaldnordeng, sonja4203, carlylevi, heather8357, eilisclaire, karin8430, arthurarnoldmsme3019, familysheldon5574, rashid7425, steve2963, tineke9409, onehorizonfoundati4189, mbakir, angel5885, joseph7919, jonasb, stephanie1957, arjen8681, adina4560, pawel1132, francesco6506, patty8900, moiss3475, danial9484, michael86918867, alison6772, rameshandusha9440, howard4162, elenamaria3140, kyle8193, ali6397, michael2956, michael2956, johnanddeb7757, becky3790, sue9843, glenn4127, pamela5404, brenda2768, JonathanCross, nicolas8650, katharine4199, jean4746, divingdoc36, lte"
474054,"christoronto, sandra18392854, rebecca5562, bahman3768, ryan8155, kcw888, AndAboutTimeToo, ren1521, hoserdude, diederik8163, cristobal6195, marty9574"
565616,"leslie5862, mike2208, mike86453623, thomas72335230, cathy21003662, paul87292958, haley1512, kivanc9828, thierry8170, pt3502, kristin2899, ron9226, mark1288, cmelnick, john93483355, fabienne1161, maureen3948, nathan1361, george5153, william7722, linda4357, robtinsley, elisabethl4671, vicki3963, deborahl2243, liz1426, alicia3718, kim3199, tulay5126, marion82102722, mike2420, menwithchildren3056, joshua5771, shirley3775, stuart7898, john7455, kentaro8903, leah4243, texasdevin, wakibi, irene9004, anthony6740, joan1909, shibazo, pacificdesigndirections, dan9243, christyandbryan9563, jennifer3723, stephen2977, mindy1111"
115653,"punahou9964, paul1270, hanny9985, karen2353, emily6330, sri3570, michael3151, david8602, jeff1667, stacey3436, albert1092, abel8754, luis2592, modupefoundation, michel2582, percy3073, philip7174"
116346,"punahou9964, steve3026, stephen3185, rubylouise9357, isabella7213, mary8860, ray1511, joanmarie, paul98448449, steven3248, alexa3090, maury4573, donna1297, aopalach, gooddogg1, leavenworth2687"
269996,"punahou4014, punahou4014, rashmi1455, travis7340, travis7340, richard41598462, jane4963, penny6033, farhad7, kjellrun2116, sebastian3535, marianne8366, twofromindy, grant3995, festival, davidsitsky, christopher5175, lori3484, john7153, tainanian"
141382,"chris7717, mattandstephanie1128, alfred8304, jonathan8872, katherine5733, tracy7251, chrispadfield, alberte7270, rick1069, thuy6190, nicole7960, madbaobab, gina45179177, patricia77733514, catherine2333, jason8556, dirk2245, ed7413, lisa8864, fa8594, drewandgary, lemsfamily8690, amarshah, eden1458, tom69452291, laurene9060, natalie6405, joseph6482, donna4184, donna4184, thegurbafamilygroup8688, antoinette7505, kishan3942"
386655,"rachel9469, andy2383, rebecca7116, craig6157, axel5045, jane6446, katelyn9944, inge7311, nina6498, johansosa, john7424, tobybot, washingtonassociatio1901, david6513, kristen5227, susan3253, tovekristin6895, amanda5083, jackie6564, dianelampert, linda6059, steven4167, veronica1371, jackie5580"
560512,"coleman5312, zachary8135, springfield6261, ray1449, sandy3536, janet8978, victor9593, james5666, vernon4221, jon7037, bobthecat, diana5408, sylvia1521, andrew5306, manuel6463, andrea1984, markus1717, robert45207828, andrzej5742, karyl7566, mildred4681, wuikeong1541, marco9703, lawrence9162, markandrhonda, david26258053, john5759, don1119, robert1560, chrisandkaren9847, jody8154, andrea8724, glouise5622, bardetfamily3208, christer8139, harry9697, lisa4526, cynthia2623, kristin7320, briansayrs, joe5392, miji1769, danielle8312, darlene6876, elke2463, kevin66887327, barbara7679, nancygraham4100, stacy8077, swansons, brandi5378, kenneth3733, sean3482, leonard1251, gabriel8904, gabriel8904, gabriel8904, jason7160, katja3719, gail4094, shawn1590, jeroenbergevoet, peter3613, dustinandkelly6283, stephan4020, jeffrey2493, paulandjennifer2667, alison2025, alexandra9167, mourad1017, thomas2368, funkymonkey4439, brit6392, anita8718, alan5513, Oliver10303, david57361174, melani5491, larissa8107, amanda1707, david7727"
133407,"ofiraandido4543, claudia7725, michelleandmike4964, leo4507, lauren8390, anng4704, bhim4947, maggie5166, alison5975, xanandsandra9271, jesus7644, jan2646, frances3422, pbussey, hilary8097"
132531,"punahou8027, damon6826, cypof, damienbrad7748, thomas3814, andy6187, michael7595, derek3363, sam5523, alex6635, robert55023096, rajiv6480, ali8931, matthew3365, duncan9354, peter8719, jesper3482, punahou4033, anand4682, laurence5353, harold8775, eric1594, pacificscreening, rana7074, bobharris, dave7278, dave7278, charles6577, vance9483, vance9483, ashish7569, shailesh, jason5878, chris3796, richardcraigdavid, dwight8239, deepak5434, stephanie9113, seven4940, jackie7746, victoria5985"
234651,"herve1944, james6679, david1794, marko7201, joy9408, thomas8882, bill7587, glenn3111, dan7069, doug8366, lavanders, tom4364, randy8593, thePCapeman, tom1503, albert1092, dave9403, anila8851, mehmoodn, neal1250, harishandkristin1702"
