LOAN_ID,LENDERS
432449,"kurt7817, ninad, giovannicataldi4083, lee6682, jesse28526684, robertsanek, robert4764, max5129, bmarar, jennifer1621, kevin57865780, joelandmel, ingeborg8163, jimish, randulo, dukedelaet, ceceliazielinski, kunal, harvey9190, harvey9190, stephen3185, barbara5610, szucheng2565, caro7974, aaron83574977, sue1024, joshbaltzell, monikdoshi, shannon2449, hank4037, daniel6944, doug7962, chris6320, philip1838, erika2271, michaelmaccormack7, ldddo8166, philip7174, snorre, laurent9392, serge7667, maynar4752, michael6729, michael6729, michael6729, michael6729, mark2704, miguelduarte, eileen3405, KyRoamer, oliver8216, justin5267, jens4767, tyleroakley, cairo5901, worldloveorganization, eolson, bunji2089, trevor777, soroptimistinternati6690, harold5997, harold5997, dennislin, sander3009, stoian9148, lucas94586976, nancy1447, darthbear, maffiou, christina86186360, steveandlauren, christian9832, stephen2848, stephen2848, highgrovechurch, 123321, bonnieandsteve7223, michael26322898, tom1714, tom1714, tom1714, tom1714, tom1714, gmct, yune2048, benthelefty, raabolle, trolltech4460, david63077785, david63077785, david5193, thomas9998, paul9616, mara8553, jonathan8335, jillian1643, meganandjoe6381, helen9599, erikoncho, robert30127055, kjartan2708, james9079, r3922, roland2980, shree8053, amy6041, amirali5409, susan94336871, Mondololloso, paul4243, michelleandkristian9819, david5071, gregory2085, AtoZ, jonathanstory, oakviewroberts, brendenfamily2485, srenchr1931, john9255, william7215, william7215, jeanluc9583, rebecca5152, nazaret7843, nazaret7843"
401534,"nick8525, jacqueline2370, rebecca2233, zachary8135, sacham, pg3233, art7961, fairspirit, brett7102, tom6067, ester5226, steve6803, gary5829, sharman9389, karen9003, paul3833, michael2910, emma6745, dana1904, rachacha, catherine1808, jonathanleger, juha4116, kevin2064, georgina4040, simone7152, richard4874, brian5783, sunil8930, haruyuki5095, walter5296, joselita8592, shelley2449, natasha6949, jensdamsgaardvanar, jeffrey5016, pratyusha87, sisir5804, chris8115, kivanewyork, kivanewyork, benhutch, graham9463, graham9463, NikiAndFamily, murray2521, joseph5144, chris2767, doug7962, cgull, phyllis2903, william26708089, kristin8308, pierre4193, evab4407, kbp7801, neoaid, bonnie16381663, wolfgang3771, christie6577, blair4467, lisa1851, ane4472, joeandjinette4240, karen4442, jandr4351, trolltech4460, jennifer93652353, nathan3237, jangoyvaerts, eric3883, gooddogg1, jim3451, cheryl55404269, melissa7514, bjrn, kay7366, elizabeth4313, mertensa, katrina1405, Oliver10303, Oliver10303"
1343277,"neil8568, lingtian, savedbythedress, joseph3000, themissionbeltco, ngawchee6402"
1342255,"mathias7160, liviu7839, rob9630, savedbythedress, kerry9933, thomas7706, lucy43567853, cogswell3917, rik8272, danielnilsson, brett4445, InternetSweden, paul4243, nick9995, sharon9045, themissionbeltco, william15239422, thomas4449, ginny4304, jan5271, carolyn4664, chieko7550, pablo3301, calvin8999, craig1807, thomas11879108, wakibi"
1343949,"ronandelizabeth1596, william4267, kimoon3179, waltersystems3228, nicholas5288, karla4562, gooddogg1, jesuan5626"
1344037,"jean84605891, david52201785, bradley5620, veta1758, cliff5639, kenneth1054, sergio1112, gloria7457, katebennett, robb6580, john81726436, barbara8970, michael98221075, SamEllens, gooddogg1, julian8731, peggy5078"
1343920,maryellen6459
1344041,"jean84605891, mike4906, david52201785, james8688, gae5626, cliff5639, sergio1112, robb6580, vana5220, john81726436, gooddogg1, julian8731, jessica5315"
1343452,"savedbythedress, mohammad8433, manywaters, sleighty, majed7195, oakviewroberts, rubina1425"
1327804,"savedbythedress, bojan8634, melissa1630, mike7561, mike9433, joinFITE, allen3199, darcy2377, barbara5610, theresa4018, merrie6827, denise6312, maplegrove5841, ronandelizabeth1596, ronandelizabeth1596, donandkathy6425, gary6694, jouko1940, pixelspoke, lisbeth1722, julian8731, ambra, bouwinabeintema, ing5038, fritz3112, shawna3245, janice8309, grace3427, maria44596761, sue8423, colm2156, susan9311"
1344958,"megan67542890, savedbythedress, robert31383775, william4267, whitneymissouri, david3839, nicholas5288, robb6580, teamchina07, vanhara, trogdorfamily7622, ali1493, nicholasluder, jillian7263, hj8166, onemilliondollarteam, tiy4057, nicola1093, anne2431, themissionbeltco, richard3905, charles4253, gooddogg1, javisagan, vineet7754, charles1744, henry8741, singaporesparty, habib3541, iyer, michael6729, deb1502"
1335724,"calvin5914, ilaria4026, ben29204211, chungtnguyen, robandjo1798, shane1720, erin9097, melissa3403, claudia9520, william8186, felise4586, karibi3827, erik1734, carina8482, will8174, christina2916, heidi5384, andreas5387"
1336304,"darlene9737, eduardollach, sarah83079025, kevinbbriggs, stephanie3051, don7959, bernal4335, am8748, shirley1905, alice3649, denise1005, larry2011, braydenandmaddie5640, chele, amirali5409, zazzavigne, fmciriano, mariomuc, stevethomson, vikas7863, thefrenchpatisserie9330, pankaj6113"
1326276,"kelsey1030, matthias1958, eva6163, leo3833, donpaul1961, jodie4668, rose6985, michelle1805, ann81534301, lauren7008, mary9460, elizabeth4344, alyssa8016"
1343884,"patty6480, awayinward, ryana9900, andressastre, bobnoxious, paul6409, bewell7604, brian65273854, libragopi, altra, sunnybankgroup2165, vanhara, keyvan9314"
1334677,"thomas5391, oakviewroberts, jonathan1313, lisa5533, alhbab, pauline2965, brian65273854, shawna3245, sueandjon8940, michael2744, maria44596761, will8174"
1338005,"sharon9045, lidia5529, janet4068, thomas2238, max9370, jani2599, brian65273854, katie3600, amy94597239, michael6666, barbara9022, irene1993, matthew2782, joe2322, andy42787631, craig97299604, advocatesforrepeatbo7716, trolltech4460, james9997, teresa6839"
1330952,"rick3647, barbara5610, oakviewroberts, matthias1958, maria44596761, cynthia3256, denise1005, ing5038, denise1005, flateric, erhard9980, nancysomers, denise1005, Birdman, jouko1940"
1693341,"stephen4828, mahmutayberk3353, emily1026, trolltech4460, mandy9799, gooddogg1, nms, esa7212, jill7945, savedbythedress, wael3237, lynne4934, clifton9193, michael39866344, therese7564, joinFITE, cyril8546, cathy2037, iomba7420, lana6142, gianluca7274"
1708438,"fracktal, exvestment, sally7146, harryhugo7819, nolan8919, trolltech4460, rose9204, nms, thani9091, sean2663, laurence5353, pablo8258, brynjolfur, gooddogg1, napnam, scott8415, paul7867, laurie7646, douglas7365, seif, allison4465, mckenzie5733, peter9530, gillian4882"
264449,"magdalenaf6306, beth6197, nanandbritt7742, sandy53079806, dotlarry1702, claire61462652, erricka8363, stephen6274, thom3557, courtney1046, pat9581, geri5327, cara5588, riittaantti3135, charles7107, brady5487, wwwmormonorg3731, danielandaime2467, william3498, mary10585354, donald1176, nancy7888, jeffrey5455, gerd9549, danielle1222, gooddogg1, catherine5066, sunshine, zander5881, meredith7339, steve2367, Jodi2871"
550253,"martin6147, peter66854014, michaela9851, jari7289, katrinahutch, rhiannon1472, angela3357, fagrell5442"
480220,"daveandmorgan, eskimo1127, walt6358, selena1671, k3437, victoriamicrolendi1164, brittania8957, tim1351, yannis8960, linda9489, doug5402, richard2860, nicole2295, sharon2917, michael8013, allison9598, tom4285, christine4591, jess5787"
380000,"joseph2708, danica2705, rolf7891, garytammy7796, gojiyerba, stephen1834, aubrey4135, kiva8849, kirsten5064, ewl, jeffery8255, jeffery8255, brian3557, brian8516, richard1051, marc2446, jim5285, jim5285, charles3384, william7464, benjamin8925, stewart5114, hao4702, berliner, chimbila, hanbybd, jameswong, michael29522635, christian5823, paula8068, andy4307, jill39135249, monica4223, SideshowJeff, john53465176, lillian1469, ottis2371, seanatron, seanatron, mary70069739, andrew79427405, howard3455, UUCCH, dominicjoyce, donandpeg2782, colin7069, steven2928, dan4230, virginia1031, thomas4090, tulio, frank5447, nicholas3062, kev5945, 3beditions, charlotte8127, richard7564, joleif2323, alon3238, adam4479, melissa1171, sandeepshabd, cheryl8280, glen2035, beverly9145, sandra8635, courtney8343, craig3251, kushal5421, phillipowen25, laura6265, shortsbrewing4134, teri4884, taata9338, boaz5464, anonymous20200701, phillip7956, scott4218, scott4218, rebecca7745, susan5082, valerie7729, erin4551, rich1593, sara5316, thomas5309, patrick8382, baskit6736, chris1770, daniel9677, joe3404, donna8125, catharine9780, jeffop, maeve3048, bobharris, chrisb, dynamicdevices, michaelkeng, manabu6368, harriet8754, robert4322, fran1389, stefano4107, norton8754, jager7732, jager7732, modernpapyrus, lisbeth1722, thomas9349, tess6120, dustin5157, brigitte1954, david6614, pip, gooddogg1, carl2627, christine1562, alessandra4665, regina9868, alvachurchofgod, juhyungsun, steveamunson, lacher9367, paul4952, kenny9076, david3618, starmegado2009, jay8919, john27046694, oregonjohn, danielle2293, danielle2293, aileen9726, matthias8345, hattaraa24601, conrad4947, brian8839, karen2262, sHu, mark9491, moe1596, jarredandannette5671, krisandmelissa, christy7908, sharyn9634, chris4520, gwen9081, gwen9081, gwen9081, peeta5736, cindy8242, dan1484, bevin1355, felix9562, elizabeth6518, allbery, jessica5609, peter7303, ronnie5616, timledlie, jack7020, spmoran, rita9769, jennifer8985, rebecca9693, rex3498"
250334,"elena8599, lauren5828, dustin4739, frogpond, michaelastle, aiss8541, brian5392, stan7426, david7349, monica9857, janwillem3514"
256137,"daphne3259, d6982, laurie1295, chuck8900, lexieandjulie5388, kelie5322, arda3659, peterjean3514, bruce3910, blakeannazachary1341, tim2963, martin7896, yves2375, trevor1873, linda7411, ada2322, john7508, andreaschristoph2945, becky1360"
366248,"carmenandmichelle2228, maryrita3118, john6921, john6921, praveen9688, john2365, anni6685, hayette2181, faris6466, rebecca9973, raquel1533, elizabeth2639, naomi1995, murrayanddixie1839, r3922, curtis2912, michael7446, trolltech4460, dariolopez, dariolopez, dariolopez, dariolopez, gooddogg1, michelle96799862, Neelu, monica4006, nadia4700, stnicholascatholichi2701, 123321, ricklinda6071, alice6448, miratel8800, tracey2217, albert3901, hany, tania2029, rebecca3499, kevin8310, stephen97823337, susan18828974, susan18828974, natalie9978, james1344, peter50773497, frode8973, mark6398, miles6989, michaelandjudy9962, blake4772"
590514,"simon7977, artur76, artur9240, sarahmia, lars5757, holley3717, thierry8170, christopher2561, owen7229, jonanscher, chelsea5562, brian2052, smoffette, arjen8681, nuno7561, robertpechlof, mitchell34687254, matthew75286618"
575940,"steven5701, christchurch9304, the147man, devika5831, tyler2367, sheryaz7413, chuanpow9262, tom8441, SEEDS, raf4143, doug7646, prosper2251, brad1778, jgomes, vijay2277, alejandro5210, mark29101514, mike3972, barbara33227752, gina6842, allison1146, heather3936, frank2140, yorkim4914, miriam1835, han1234, nick9778, joseph3768, christine9439, phil1644, paul4667, damian7242, britt1482, jeremy3412, greg9133, amy6716, lauren1083, richard8069, FLAME, 3beditions, graham7504, rick4942, bankerslab, wakibi, wakibi, james8046, charlotte5810, jozie5847, jamie43222438, christopher15027884, matthew2782, shirley1905, kay1395, adam2514, michaelmitsakos, SimonC, peter7395, merleandedith7445, merleandedith7445, ulrika4277, shivshreya7894, michael49229917, charan, bob2226, bobandjuelle3722, michael3737, russell9579, greenleaf, curtis2494, laurent5974, brockfamily, alex9498, balachandra, rebecca3038, nicola1093, tracy1075, michael2438, nunodel, richard4647, benthelefty, benthelefty, emofund, steven9748, rob9037, jeffrey4552, ryanreif, christopher9435, jayeskenazi, james9623, tanja3011, rodney1267, petri1987, alvachurchofgod, steinar6538, steinar6538, caroline1254, william7277, magdalena8471, SamEllens, jo6294, art4837, michael3506, linda14511458, skreened, paul5624, scott7662, luke7335, jensdamsgaardvanar, jensdamsgaardvanar, charlesweeth, jillian1643, ronandelizabeth1596, roger9467, trent5201, howard7012, edie5066, samuel8067, cynthia5225, dennis2113, bondurant, sren5954, aaron83574977, charlieseddon, dermalogicafitecanad2401, barb1428, patrick2650, ace0, lchunt, nienows, ankeandfons9022, adeep, whbc, john37481062, john37481062, sharon3398, meetz, marcin5351, meredith5240, bhavik8309, donald3467, garrett5733, dan4564, brian87298920, brian8634, megan7920, john1972, yourposition, frank6126, jake31, jesper6614, kivalenderat5am, dborquezm, starosto, michael77785822, maja7527, celi, michael5418, carolina1572, travis7830, karlandsafiah2256, roger6442, jonasstockholm, craig6200, benjamin4226, carlos70125, bekki, linda7949, linda7949, Popetim2, george5404, hans8594, eric9311, matthew2497, matthew2497, kaywin7764, kris1894, rachel4358, bill41553383, gregory2085, david3043, chris23964295, bill2399"
430328,"sebastiano8247, patricia1513, hj8166, rachel76832162, lancashiregroup8262, alexnjoyce, olakunle8842, kevin5842, gareth7990, tom9288, wongacom3393, pattiflynn, peter71658151, karen70318837, annariina9541, cees1296, silke4854, bero, bero, elsonschwab, nirvan, nirvan, sandra90441563, sue6255, gregory2085, dishforum1163, kai2007, marybeth1684, albert7460"
1695909,"liwee6658, adam8512, syed5970, hasbini, jason1177, juanita5060, jack80, vstuhlen, rick5973, cyrill6433, ywgdana, kathryn3657, travis9112, kenneth2840, julien8044, jeff2453, jerry6111, molyvann2671, jayne8180, maryanddavid2477, brian35185640, jamie1759, sue9155, dale4161, hassaan, themissionbeltco, bashardari, sameer, seif, siamak4227, nicholas1022"
100945,"PKBanker, paola6964, christina3972, judith1291, reid2699, spaceman70, duncan4746, andreas6490, connor4241, shawn2651, salt8082, melissa7139, tod5947, brigitte3998, simon8243, akawesley, craigericazeke2192, sam8086, patricia9852, stephen7767, dawn5404, rachel76683597, mk22, reganchen, phoebe8608, laurie5648, philip7790, cindy7485, cheryl4035, rob3441, kathy5156, generationwonder3274, michelle4540, vilma4975, sylvia3798, anthony1525, judy6982, jane6702, davidsharron1953, travis9802, tracy6960, hoff, cherylann, victor7639, nancy1046, kevin21996038, paula4788, zawadi8552, zawadi8552, jennifer2439, roberto9067, jimandjean5638, dannielandcindy3373, mark5132, richard6961, joyce7360, kdiane4112, sherry4869, carol7275, asif8541, brian9207, ilias5172, michele3570, sean5887, david2884, amber1738, lindsey8996, marybeth4450, robert8052, lucy7696, mark2558, jesse6738, davemundy, steven3253, nancy3597, edward7891, solupine, oluronke6202, arturoandelizabeth8171, overlyfamily4075, overlyfamily4075"
498248,"joe1827, vernon4221, paul8830, erik6760, lakshmi8913, markie8039, andrea8490, julie74333900, phil7528, vitoaf, vitoaf, katsujiro1653, cstor4253, ashley3605, liammc, linda34472893, paul4886, missy2484, missy2484, ross17766426, faith4757, blakeinclovis, virginiajennie9445, kasy4233, shavkat4701, adriaan1537, adriaan1537, gregory84714836, sharon52808642, janice9533, frankwyman, simona6903, kevin7685, sharon047, sandra2882, kristiaan6907, linda7961, mbrfamilyfoundation, lisa5044, gabrielle1448, ann4596, peter9965, erik2719, ludmila8389, cathi5504, teachingtofish2659, tolgaors, valerie1981, kirsten7887, family1255, julia3592, henrik5414, gary8668, shura2508, christopher3386, oddsverre8907, wayne4972, elizabeth72985972, tor8481, peggy9869, robert7842, craig97299604, henrik2132, cassie7151, john49627065, mark5467, richard2873, phil3624, laura11987644, christina5689"
206282,"arie3405, rmiller1000, scott1681, jbbdude, cathy2037, iago9529, trogdorfamily7622, roxy2476, quinn8153, liz5409, thomas7482, levantine, kusuriya3com, trolltech4460, rich6705, andromedaresearch, marco1254, ianthatcher, neeladri3559, neeladri3559, srinivas5697, buchananfamily, ryan6583, ryan6583, reynolds8404, roberto3605, stephen1825, healey9933, david48299624, michelle3637, orin4425, kvasbo, Berry5964, holiday6306, michael2223, victoria9970, danny6470, roberta6495, keith2375, glenn9927, mauri5204, sheryl3624, louandcathi3397, janandsiga"
168682,"maria4117, yonee, don9212, sharon9422, matthew2546, david7683, janet2180, jeanlouis4828, signo8912, eric4447"
442255,"sherry4828, stuart8665, renee4919, kiwi, iain3458, jessica3947, alexander9201, rosie2453, harry9605, paige7452, paige7452, sherry5255, amber6816, sara40706724, aprilnewman, michael9533, michael4929, jack4550, vanessa3544, lkbm, macfamily5428, david6037, joan6711, michaelandkate7921, JamesCarolynCooper, seth5484, amirali5409, charlotte6793, gooddogg1, jessica2829"
35252,"arie3405, sara3196, teresa4115, grs8214, patricia5947, amy3998, scottregan, jgolden, eddaandandreas8744, rickandpeggy5365, lori7284, linda9522, jeff2385"
307693,"robert8503, exvestment, MakroM, justin4823, marcus5163, william3579, 94704, kairi, johanna7929, bellarmine8597, jfossaert, kirsti4776, dianna1747, michael50548401, cecilia8952, harri4369, christopher38035375, gooddogg1, karen3859, madnla"
61768,"cecil9896, allison7023, theo8260, richard2298, monodb4513, scott5107, donna3480, glenn8401, doctorchou"
178095,"david1654, ErikaL, martin6956, samantha5745, reddoor6317, jason4438, maggie4276, fred2120, karen7009, patrick6613, samaroo2048, jim5285, andy6187, philip1838"
321756,"tyson3352, amethyst5339, david32864714, dana4458, casperklitmoeller8661, gordon6174, norridge, cran1um, wayne7598, christopher5175, christopher5175, pakalulu4331, bob2806"
419944,"tyson3352, FrequentMiler, henk4073, laurence5353, iolaire, kivaatconferece1990, alexi3265, john97245037, jouko1940, highgrovechurch, linda1544, tim6602, auni7901, steven4082, anette3458, tomas6705, gooddogg1, anon23456"
370340,"simon7324, xavid7587, hans3822, emofund, reallyreallybig, ann9406, howard7012, bjarne1048, shannon8554, jeremy6608, jack8907"
373343,"simon7324, elizabeth8801, hitflip5842, kristen4598, kristen4598, bronwen5110, patricia8532, cynthia4341, travandbeck1292, alison3296, susan3706, howardbell, melanie1807, anjemller3116, hornsbyrotary, pimenhannie1777, saskiavanbrenk, bill82176405, jakub5251, michael97776782, julian9656, thies9899, megsam5899, helmiina7674, david2932, ignacio9604, bernard7279, gcgox5500, shekhar8235, bruce2871"
352543,"jon5715, maggy3590, daithileonard, margot5744, kirsten1186, jen1064, emanuele2274, angiolo, johan34995099, alan6074, hanna2933, fsdata, trolltech4460, manoj5334, magnulf3626, heidis6690, christoph6273, kpalmvik, mariah2972, robertcastaneda, fairspirit"
348749,"katherine9010, jenny7775, victoriamicrolendi1164, lisa30606761, steve4742, laura17887693, sara8344, milenko3967, andr8531, jangoyvaerts, deanna2404, lisa5306, isaac7650, ron8631, sue9509, highgrovechurch, doug2362, beatrice6892, pascale6899"
174303,"david3543, jess5520, amlcftgroup, ian5816, andrea4174, donaldchase, fred8864, elisabetta8238, mayur4586, desiree5657, christina6068, allysonb, sara6518, jeff8342, cody3681, stephen3317, tom1373, diemperdidi, goawayplease, vivianDieter, john3742, jdavid5224, karen7642, steven6384, stluke6101, anna3383, tag, john9761, michael9245, chuck6766, renate6541, irvinmac, benjamin73949051, nancy8742, christi6113, matevzs, cindy1853, patchworkminds6650"
226006,"tyson3352, ray5832, ingemoen, gavin1581, renenandrea4972, wendy5507"
71637,"felicia4756, kris9591, thom3557, theresa1346, jonna5745, donb9292, bridgetpdx, lcisocialstudies1956, peta3277, bo9646, renae6510, festival, michelle8659, john8478, stephen1170, theresaandallen5220, alexandra9052, arad, sylwia6667, sylwia6667, lorenzlk, greg1724, markgrimes, pauline2712, patpatterson, adria7210, tim3019, jeanie3511, carolina5863"
32590,"badmamas3852, sylviaandnina, jill2910, cassandra6145, herbert9132, socialentrepreneurs6331, lorne7451, livingwords1598, david7193, melanie1807, steve6779, dick8634, ralph8413, louise9038, olivierFromLille, dan2949, barb3418, andrew5018, howard7989, teresa2780, brandon9426, patrick4756, phyllis9577, kelle9273, liulin7246, cindi1024, judith6711, ewa4216, adamfamily5513, dennis3876, carla6770, erik4554, dinah3425, padtinc, johnhunter"
513535,"emhiller, timov, rachel9373, lodewijk2824, maria44596761, michelle6486, benyi, rachel3096, joel6064, leena1294, elizabeth5434, solsticebahamas, trolltech4460, mads1174, wasan1356, debbie2924, danny4355, cleverspenden, stefan8480, diane42387097, grace4103, jose7953, bethanyGimaging, ewa9689, Oliver10303, jeri5017, clive5910, isobel3963, halie2694, barrie7327, john1972, gerard6210"
553272,"sinta1986, karen3747, jessica2140, mary1690, robert2678, jessica32704686, hyun8408, michael31152787, linda4597, lynda9908, nadine5959, jimandterre5465, phill9950, kyle6007, emily5536, gooddogg1, teri7933"
416003,"zahra3154, peter2998, michaelandmegan8390, thomasand, thor8098, michael81791694, joel2790, mikael2901, edf, benjamin2916, sabine4272, ricky7507, david7212, howard4162, dougandterry2521, portma, pamela4160, schaschon, elizabeth7466, fedde8730, dennis9994, jerrold1926, ernie6750, menno3710, garry7837, matthew9814, harmenjan"
81415,"theresa2546, georgeandlinda8976, ron5435, stevelucypaulan4163, nancy8779, william4369, chris7043, brasherfamily7289, yorelle9696, ahmad2592, andrew8456, kathleen1660, kyle3481, gislinde3492, penny6946, bryn8259, brad2601, fredandkathy4825, garrett9554, charlotte4657, thomas4449, morgankiva, jennifer37116821, diane4523, diane4523, andrea3268, jerry8141, deena3634, michael5288"
127729,"christoffer8662, ben6952, michael8882, kenneth7506, christie1430, hugo9318, william2701, molly4727, laurie8255, bethmc, barrierseymourfoundation"
213876,"uday2078, richard8069, pia6905, deborah3149, angela23259280, jenni4851, stephen2826, don1125, janis6161, sussi3690, barbaraandben4505, paul7639, brian9307, samuel5178, martsrinandpete9620, declan5722, InternetSweden, martin5593, teresa3720, charmaine1388, anna3383, june2157, andrewcanada, morgan7170, cathy1415, kathleen1523, leslee7179, harry9885, tricia4408, david1615, carlos5246, jon3441, helen7635, helen7635, robert45903468, coleen3621, steven9800, stevyn4314, kate4169, kenneth4478, drea8743, melissa3957, gary2781, gooddogg1, rich6705, wepaustralia5065, aleravanetti, jan4678, vincent4597, jean6847, stmichael5912, meghan1457, donald7035, christopherm5494, barbara6096, finne6141, ivan7785, suprada, nancy7084, julie5885, jack7214, jack7214, mattiaslaven, megwestlake"
388017,"jonathan2205, tom59673895, johannes6275, nicolas1198, jeffdebbie6723, susan3595"
128220,"chuck7975, marla7827, william4053, michael1087, clmcgown, joseph6483, eric2181, eric2181, graham9835, doug7903, john92261791, brian3476, belinda9229, robyn3735, zachary2087, jeff5720, darrylandtaryn1888, al7998, jeffevenmo, giovannicataldi4083, joseph8478, richardw4625, don9212, giovanna8107, josh7135, dan6332, jesse2770, constance8131, kymberlee9503, sandyandjerry2627, marilyn1888, rudigerw, robert8251, john9242, john9242, greenleaf, lynn9538, andrew8133, michael1414, daniel4403, del6200, laura6693, nancy8677, markandsusan4357, james51364647, tim1284, damien7265, lucia9803, scottandcherie5721, kathryn8106, jts8337, valandderek2847, brooke5428, sheryl2336, hugo3169, jasonpark, gary9515, scott8014, andrew8988, mark6622, william7215, nan8294, louiseric, thomas4171, melissa7742, glenda1348, tracy7251, brandon7105, brandon7105, nigel5030, alex7902, brian5281, asbjorn, louis5999, susan5543, barryandlaura3434, phil5384, phil5384, tyler7579, electra6813, carter7482, peter7821, tom9824, pamela3553, lukeandvanessa, douglas3729, roberto3605, ACHAIAH, susan6836, chuck3581, charles3134, beraca9341, heathereric6351, seantieck, johnsterling, globalcitizen, joao6306, brad1778, gooddogg1, michael6605, melissa5921, paul7554, jasonpitre, rebecca4213, glenn9927, lea6952, cecil1239, rotaryclubofkorea1918, danica4979, lisa7431, mark7336, moom, delsa7805, barry2087, daniel4574, antonio5774, whbc, lyne7021, micahfullerton, michael78, lauren4636, mattiaslaven, julie21454089"
125242,"michael4325, constance8149, christian70378807, michael53775481, calle77, ashleigh3711, jerry2670, emily2142, joseph8580, michael17569718, gavin3323, ruth9374, jason1430, tian, sociology3523, docky8343, rebecca9403"
188725,"timothy8936, timothy8936, matthew7350, karl8259, whitney9021, artur, edean6631, scot2162, heather7940, ray5630, helge7476, kaer, dana4858, ellen6187, david3730, lori1109, alexandra9829, mary8777, riverpath7358, tomblomberg1928, gooddogg1, greg7477, kdanila"
462733,"jane9828, willandsarah3245, elaine8207, nicole4211, kira6029, alan9463, mandy6540, stephenparsons, damian1, stacy1657, phuhoa9764, james7271, iveth7291, jessie4081, ken7348, joanna9426, vicki3483, vicki3483, alexander5847, catherine8034, amy2351, junelle3270, trolltech4460, lifebuffet, karly1820"
361759,"jane9828, ronanddenise6108, gm7967, ulmquebec, joinFITE, joinFITE, joinFITE, guhin, pamela3347, linda2249, jean3783, oOo, steve29408883, mark50446742, julie4679, lesley5104, anasofia8190, trolltech4460, paul6593, sylvia4605, elaine8719, elaine8719, timothy9075, irene3658, teresa7894"
38918,"lonneke2280, samuel2103, robert9237, urban1150, george5908, kel5743, sam1998, georgie6647, garylynch"
508371,"paul4974, salvador9310, ellen8956, benjamin6143, peter91094258, afalk, carl2754, michael2698, kathy2079, michelle4368, peter4443, pam7158, kakbankuppsala, trolltech4460, mikehollycarter, inflowinventory, hannah1340, ian4804, amirali5409, denanicole, sean3824, thylacine8332, zach2528, catherine9251, danni5527, henninghenning, robin8227, lori3378, juergen6502, vineet7754, jennifer20628666"
189639,"namesuppressed, arvid4509, jncraton, sean7744, luc4678, thomas9479, andy2463, leopold3690, susie6709, colin6689, colin6689, richard4594, brown7434, alma9844, christoph2157, william3414, matthew9667, robert3495, fernando7890"
